Dazu entwickeln wir eine der größten und technologisch anspruchsvollsten Omnikanal-Plattformen im deutschen Banking-Markt.;0;0;1;0
de Gesellschaft für Verbraucherinformation mbH vertreibt über Onlinevergleiche Finanzprodukte aus den Kategorien Immobilienfinanzierungen, Konsumentenkredite und einfache Bankprodukte;0;0;1;0
Design und Entwicklung verschiedener Softwareanwendungen im Banken-, Börsen und Wertpapierhandelsumfeld;0;0;1;0
Die Abteilung Entwicklung Kreditbasisfunktionen ist u.a. verantwortlich für die fachliche und technische Betreuung sowie die Weiterentwicklung der Berechnungskomponenten für Aktivkonten über deren gesamten Lebenszyklus sowie die Präsentation der Ergebnisse.;0;0;1;0
Die Banksoftware-diensleistungen von SCAND zielen darauf ab, maßgeschneiderte Anwendungen bereitzustellen und bestehende zu verbessern. ;0;0;1;0
Die bis dahin mit einem Marktanteil von 24 Prozent (gemessen an der Anzahl Banken) Nummer zwei in der Schweizer Bankensoftware-Branche konnte 2008 drei grössere Kantonalbanken akquirieren;0;0;1;0
Die CPU Softwarehouse AG ist ein auf die Entwicklung von Software für Banken spezialisierter Konzern;0;0;1;0
Die Ende 2003 fertiggestellte Standardlösung Finnova Banking Software ersetzte die veralteten Gesamtsysteme, gleichzeitig erfolgte die Umbenennung in finnova AG Bankware, kurz Finnova;0;0;1;0
Die Finanz Informatik bietet unterschiedliche IT-Leistungen rund um die Entwicklung, Produktion und Bereitstellung von Banking-Lösungen (Kernbanksystem, Online- und Mobile-Banking);0;0;1;0
Die Finanz Informatik ist der aus dem Zusammenschluss von Sparkassen Informatik und FinanzIT entstandene IT-Dienstleister der Sparkassenorganisation in Deutschland;0;0;1;0
Die flatexDEGIRO AG betreibt eine der führenden und am schnellsten wachsenden Online-Brokerage-Plattformen Europas.;0;0;1;0
Die Hypoport SE (Eigenschreibweise: HYPOPORT) mit Hauptsitz in Lübeck ist Muttergesellschaft eines Netzwerks von Technologieunternehmen für die Kredit-, Immobilien- und Versicherungswirtschaft;0;0;1;0
Die IZB SOFT griff neue Entwicklungen des Finanz- und IT-Marktes auf und setzte sie in IT-Lösungen für die Kunden um;0;0;1;0
Die IZB SOFT unterstützte alle Geschäftsprozesse der Sparkassen – angefangen bei Anwendungen für den medialen Vertrieb und die Banksteuerung über Beratungssysteme bis hin zu Personal-, Unterstützungs- und Kernbanksystemen;0;0;1;0
Die Marktlösung beinhaltete ein Kernbanksystem von der indischen Oracle-Tochter i-flex Solutions Limited oder von SAP;0;0;1;0
Die msg for banking ist ein Software- und Beratungsunternehmen im Geschäftsfeld Banken und Finanzdienstleistungen mit Hauptsitz in Frankfurt am Main;0;0;1;0
Die PPI AG ist ein unabhängiges Beratungs- und Softwareunternehmen für die Finanzbranche und zählt seit über 30 Jahren zu Deutschlands besten Arbeitgebern.;0;0;1;0
Die Sopra Financial Technology deckt alle relevanten Bereiche des digitalen Bankgeschäfts ab: von der Konzeption und Software-Entwicklung über die Bereitstellung und den Betrieb bis hin zum Service und Support für Online Banking, Apps, Vertriebslösungen, Baufinanzierung und Selbstbedienungssysteme. Dabei setzen wir bankfachliche und technische Anforderungen effizient und effektiv um. ;0;0;1;0
Die speziell auf Banken zugeschnittenen IT-Lösungen und Leistungen reichen vom Rechenzentrumsbetrieb über das Bankverfahren agree21 bis hin zur App-Entwicklung.;0;0;1;0
Die Standardlösung Finnova Banking Software wurde 2003 fertiggestellt, nachdem das Unternehmen seit 1974 Softwareapplikationen für die Finanzindustrie entwickelt hatte;0;0;1;0
Die Temenos Group AG ist ein international tätiges Schweizer Softwareunternehmen, das auf Bankensoftware spezialisiert ist;0;0;1;0
DIE VORTEILE DER INDIVIDUELLEN SOFTWAREENTWICKLUNG FÜR BANKEN DURCH LANARS ;0;0;1;0
Diese umfassen im Wesentlichen Applikationen in den Bereichen Universal, Wholesale, Retail, Private und Islamic Banking sowie im Bereich Microfinance, welche in 150 Ländern bei über 3000 Finanzinstituten, im Einsatz sind;0;0;1;0
Du begleitest den kompletten Software-Lifecycle von Bankanwendungen und verantwortest die Neu- und Weiterentwicklung von Applikationen im Backend.;0;0;1;0
Du berätst unsere Kunden (Banken und Finanzdienstleister) bei der digitalen Transformation und Weiterentwicklung ihrer Webanwendungen.;0;0;1;0
Du bringst bereits erste Erfahrungen im Bereich Webentwicklung bei Banken ;0;0;1;0
Durch die Entwicklung kundenspezifischer Software können die Banken sicherstellen, dass ihre Systeme sicher, effizient und auf dem neuesten Stand sind;0;0;1;0
Ein Softwareentwicklungsunternehmen für Banken zu finden, in das es sich lohnt, Zeit zu investieren, ist schwierig, aber nicht unmöglich.;0;0;1;0
Ein Umstieg auf deren Kernbanksystem OSPlus;0;0;1;0
Entwicklung von maßgeschneiderten Bankplattformen ;0;0;1;0
Finnova (eingetragen als finnova AG Bankware) ist ein auf Bankensoftware spezialisiertes Schweizer Unternehmen mit Sitz in Lenzburg;0;0;1;0
Für den Ausbau der digitalen Infrastruktur unserer Online-Plattform für Finanzdienstleister suchen wir ab sofort in Festanstellung zwei Java Entwickler mit Erfahrung in HTML/Javascript Frontend Entwicklung, idealerweise in Angular.;0;0;1;0
Für den Geschäftsbereich Aktiv Firmenkunden, Bereich Entwicklung Kreditprozesse /-basisfunktionen, Abteilung Entwicklung Kreditbasisfunktionen suchen wir zum nächstmöglichen Termin für den Standort Hannover, Frankfurt oder Münster einen Java Softwareentwickler im Kreditumfeld (m/w/d) Hannover, Frankfurt oder Münster Vollzeit ;0;0;1;0
Für unsere Individualkunden (Landesbanken, Versicherungen, Deutsche Leasing, SKP) stellen wir speziell abgestimmte Kreditlösungen bereit;0;0;1;0
Für unsere Teams suchen wir eine:n Softwareentwickler:in (m/w/d), der/die bereit ist, sich auf die technischen Spezifika des Themenfeldes und die Bedarfe der Firmenkunden im Bankensektor einzulassen. ;0;0;1;0
Hält das Unternehmen seit 2009 den grössten Anteil im Markt Schweiz für Banksoftware;0;0;1;0
Ihre Kernaktivität liegt in der Entwicklung und dem Vertrieb des eigenen Softwarepakets, der Avaloq Banking Suite, welche derzeit von mehr als 140 Banken weltweit verwendet wird;0;0;1;0
In dem Wissen um die Bedeutung des persönlichen Finanzmanagements entwickelt unser Team Systeme, die persönliche Finanzen in verschiedenen Finanzanwendungen verwalten und organisieren.;0;0;1;0
In den Bereichen „Digital Banking“ & E-Payments, Digital Learning & Education entwickelt Crealogix internetbasierte Software ;0;0;1;0
Kernbanksystem agree21Alle der ehemaligen GAD eG angeschlossenen Banken nutzten bis 2015 die Gesamtbanksoftwarelösung bank21, die an die ehemalige Fiducia IT AG angeschlossenen Banken die Lösung agree;0;0;1;0
Konzerngesellschaften und GeschäftsbereicheDie CPU Softwarehouse AG fungiert als Holding für ihre drei Tochtergesellschaften, die Software für Banken entwickeln und Dienstleistungen im Bankenumfeld erbringen;0;0;1;0
Kunden der FinanzIT waren Sparkassen, Landesbanken und andere Gesellschaften der Sparkassenfinanzgruppe, sowie die dwp Bank aus dem Geschäftsgebiet;0;0;1;0
Leitung von Software-Entwicklungsprojekten, z.B. im Kontext Digitalisierung von Bankenprozessen wie z.B. Vertriebskanäle (u.a. Online Banking), Zahlungsverkehr, Bausparen, Investment, Wertpapiere/-beratung, Trading, Clearing und Settlement, Referenz- und Marktdatenmanagement, Umsetzung regulatorischer Anforderungen und Kreditmanagement (MaRisk, Basel III, Meldewesen nach KWG) sowie Optimierung der Geschäftsprozesse und Organisationen bei Kunden im Bankenbereich unter betriebswirtschaftlichen Aspekten;0;0;1;0
Mit über 4.000 Mitarbeitern an 3 Standorten machen wir digitales Banking von heute leistungsfähig und entwickeln smarte Finanz-Services von morgen.;0;0;1;0
Mit zwei Jahrzehnten Erfahrung in der Entwicklung von Bank- und Finanzsoftware unterstützen wir unsere Kunden bei der Entwicklung von Lösungen, um die Macht der digitalen Transformation zu nutzen;0;0;1;0
Mitte der 1990er Jahre begann das Unternehmen eine Standardsoftware für Banken zu entwickeln;0;0;1;0
Mobile Apps und UI/UX für das Online-Banking ;0;0;1;0
Produkte und Geschäftsfeldermsg for banking entwickelt Produkte und Individuallösungen im Geschäftsfeld Banken und Finanzdienstleistungen;0;0;1;0
SAP bringt vorhandene Software im Bereich Financial Services ein (SAP for Banking) und erhält dafür einen Anteil von 20 % an der neuen Firma;0;0;1;0
SCAND Banken Entwicklung und Finanzsoftware unterstützen unsere Kunden bei der Erreichung ihrer finanziellen Ziele.;0;0;1;0
SCAND bietet eine viele Lösungen an, die den Prozess der Erstellung von Finanzberichten erleichtern sollen.;0;0;1;0
SCAND bietet einen vollständigen Zyklus der Entwicklung von Software für Banken, einschließlich UI/UX-Design, Architekturplanung, Bereitstellung, Test, Wartung und Support. ;0;0;1;0
Seit 2005 engagiert sich SAP im Finanzbereich im Datawarehousing und bietet eigene Datenbanklösungen an;0;0;1;0
Seit Anfang der 1990er-Jahre hat sich das Unternehmen zum Anbieter für Bankensoftware, finanzmathematische Seminaren und Produktconsulting weiterentwickelt;0;0;1;0
Seit mehr als 12 Jahren erstellt NanoSoft eine breite Palette von Softwarelösungen für Banken und Finanzdienstleister.;0;0;1;0
Sie sind Experte in der objektorientierten Entwicklung im SAP Kreditgeschäft und begleiten den digitalen Wandel mit Hilfe einer agilen Arbeitsweise.;0;0;1;0
#NAME?;0;0;1;0
Sie übersetzen Methoden der Risikosteuerung in anwendungsfreundliche Software und machen damit den Alltag für über 800 Banken in Deutschland einfacher und die Banksteuerung sicherer;0;0;1;0
Software für Banken. Ihre individuelle digitale Lösung im Bankgeschäft.;0;0;1;0
Software Entwicklungsideen für den Bankensektor ;0;0;1;0
Softwareentwickler - Backend, Bankanwendungen, Java (m/w/d);0;0;1;0
Softwareentwickler Banken (m/w/d);0;0;1;0
Softwareentwickler Java EE | Finanzbranche;0;0;1;0
Softwareentwickler Java Gesamtbanksteuerung (m/w/d);0;0;1;0
Softwareentwickler mit Java im Bankwesen (m/w/d);0;0;1;0
Softwareentwickler SAP ABAP OO im Kreditumfeld (m|w|d);0;0;1;0
Softwareentwicklung für das Bankwesen ;0;0;1;0
Softwareentwicklung für den Zahlungsverkehr ;0;0;1;0
Stieg mit der Entwicklung von Finanzprogrammen für Taschencomputer ins Software-Geschäft ein und Renditeprogrammen auf programmierbaren Taschenrechnern;0;0;1;0
Tätigkeitsschwerpunkt ist die Entwicklung von Software zur Abwicklung sämtlicher Geschäftsprozesse eines Unternehmens ;0;0;1;0
Tätigkeitsschwerpunkt ist die Entwicklung von Software zur Abwicklung sämtlicher Geschäftsprozesse eines Unternehmens wie Buchführung, Controlling, Vertrieb, Einkauf, Produktion, Lagerhaltung, Transport und Personalwesen;0;0;1;0
Unsere IT-Experten stellen den Fachbereichen, unseren Kunden und Partnern innovative und verlässliche IT-Infrastruktur- und Anwendungslösungen bereit und treiben so die Digitalisierung und Automatisierung der Bank voran.;0;0;1;0
Vollständige Integration von Online-Banking-Systemen;0;0;1;0
Von ScienceSoft erstellte Software und Anwendungen ermöglichen es Banken und Finanzdienstleistern ;0;0;1;0
Wir als AraCom konzipieren und realisieren Individualsoftwarelösungen für unsere Kunden und stehen diesen kompetent und zuverlässig bei Softwareprojekten zur Seite. ;0;0;1;0
Wir bieten auch die Entwicklung von Mobile-Banking-Anwendungen, Internet-Banking-Lösungen, Digital-Banking-Dienstleistungen, Geschäftsprozessautomatisierung sowie Migration und Neuaufbau bereits bestehender Softwarelösungen, Integration mit externen Plattformen, Implementierung von Payment Gateway-Systemen, etc. an.;0;0;1;0
Wir entwickeln mobile Zahlungslösungen, die von detaillierten Berichten über die Unterstützung von Multi-Device-Konten bis hin zum erweiterten Betrugsschutz reichen.;0;0;1;0
Wir liefern kundenorientierte Lösungen für Kunden aus dem Bereich der Kryptowährung ;0;0;1;0
Wir sind eine deutsche Firma mit Sitz in Wolfsburg, die deutschen Banken und Sparkassen beim Ausbau ihrer Softwarelösungen unterstützt.;0;0;1;0
Zu den Kunden von msg for banking zählen die Sparkassen-Finanzgruppe, Privat- und Geschäftsbanken, Verbände, Rechenzentren sowie Finanzabteilungen von Unternehmen;0;0;1;0
Zu den Schwerpunkten zählt die Entwicklung und der Support von Anwendungssoftware für Finanzdienstleister im gesamten Bundesgebiet und in Österreich. ;0;0;1;0
Zum Geschäftsbereich Produkt zählen die CPU Bankensoftware GmbH sowie die CPU Bankensoftware AG;0;0;1;0
Die Avaloq Group AG mit Sitz in Freienbach ist ein Software- und Finanzdienstleistungsunternehmen;0;0;1;0
 Die Cloud-Computing-Sparte Amazon Web Service ist einer der wachstumsstärksten und ertragreichsten Geschäftsbereiche des Unternehmens;0;0;0;1
 Als Cloud Solution Architect;0;0;0;1
 Als Softwareentwickler:in sowie Data Engineer verantworten Sie die Umsetzung von skalierbaren Data Analytics und AI Use Cases im Fertigungsumfeld basierend auf unserer standardisierten Cloud-Datenplattform. ;0;0;0;1
 Als Teil der Schwarz Gruppe, zu der ebenfalls die Handelsketten Lidl und Kaufland gehören, möchten wir den europäischen Cloud-Markt nachhaltig mitgestalten. ;0;0;0;1
 Als Teil unseres agilen Teams entwickelst Du in mittleren bis großen IT-Projekten Branchenlösungen auf Basis von Java ;0;0;0;1
 Als Teil unseres DevOps Teams stellst Du den Betrieb unserer Cloudanwendung ganzheitlich sicher. ;0;0;0;1
 Analyse und Konzeptionierung von performanten und sicheren Schnittstellen für die Anbindung und Integration von Assets in die Cloud Plattform ;0;0;0;1
 Analyse von aktuell eingesetzten Technologien im Unternehmen und Herausstellen von Verbesserungs- und Weiterentwicklungsmöglichkeiten für den Bereich Cloud Technologien ;0;0;0;1
 Analyse, Konzeption, Entwicklung und Betrieb von skalierbaren, sicheren Cloud- und Anwendungsarchitekturen ;0;0;0;1
 Andere Software-Hersteller sind damit in der Lage, ihre Software über die Plattform als SaaS-Dienst anzubieten;0;0;0;1
 Arbeit an verschiedenen Produkten in einem heterogenen Softwareumfeld, die von der Firmware einer SPS bis hin zur Cloud-Anwendung mit mobilen Endgeräten reichen ;0;0;0;1
 Auf der anderen Seite knüpft die offene Lösung an die In-Memory-Datenbank-Plattform SAP HANA an, wodurch Unternehmen in der Cloud auf Datenbank- und Anwendungsservices sowie mobile Dienste zugreifen können;0;0;0;1
 Außerdem werden mehrere Dienstleistungen sowie integrierte DevOps-Dienste unterstützt, um Cloud-Anwendungen zu erstellen, auszuführen, bereitzustellen und zu verwalten;0;0;0;1
 Berufserfahrung: Mehrjährige Entwicklungserfahrung in modernen Programmiersprachen/Entwicklungsumgebungen (z. B. C#, Java, NodeJS), gerne auch Erfahrung mit Cloud-Plattformen (bevorzugt AWS).;0;0;0;1
 Cloud Engineering mit Kenntnissen von der AWS Infrastruktur incl. Kenntnisse im Design und Implementierung von Cloud Infrastrukturen;0;0;0;1
 Create something new: You work in for our cloud solution of Bosch eBike systems. You analyse, design and implement cloud backend services. ;0;0;0;1
 Dann bist du als Cloud MSSQL Engineer (m/w/d) bei STACKIT genau richtig. ;0;0;0;1
 Daraufhin kündigte Microsoft an, mit lokalen Dienstleistern zusammenzuarbeiten, um trotzdem gemeinsam Dienste in der Cloud anbieten zu können;0;0;0;1
 Das Unternehmen benötigte für den Betrieb seiner E-Commerce-Plattform selbst global verteilte Rechenzentren und hochverfügbare Dienste sowie Schnittstellen zu anderen Anwendungen;0;0;0;1
 Das Unternehmen bietet seinen Kunden Stellflächen in seinen Rechenzentren (Colocation) sowie direkte Anbindung an Netzbetreiber und andere Unternehmen innerhalb des Rechenzentrums, sogenannte Interconnections;0;0;0;1
 Das Unternehmen ist in vierzig Ländern aktiv und bietet seinen Kunden Stellflächen in seinen Rechenzentren (Colocation) sowie direkte Anbindung an Netzbetreiber und andere Unternehmen innerhalb des Rechenzentrums, sogenannte Interconnections;0;0;0;1
 Das Unternehmen ist spezialisiert auf die Entwicklung und Vermarktung von Computer-Hardware und -Software für Unternehmenskunden – insbesondere des Datenbanksystems Oracle Database;0;0;0;1
 Das Vorgängersystem für diese Zwecke war das Online Service System (OSS);0;0;0;1
 Deine Kernaufgaben liegen in der Betreuung des Teams sowie in den Bereichen Konzeption, Integration und Betrieb neu entwickelter cloud basierter Web-Anwendungen. ;0;0;0;1
 Deployment und Betrieb unserer Cloudlösung SIMPHERA ;0;0;0;1
 Der Zugriff auf die Dropbox ist mit dem Browser und mit Hilfe von Anwendungen (Apps) unter verschiedenen Betriebssystemen möglich;0;0;0;1
 Design und Entwicklung von neuen Cloud- Ready Applikationen (Amazon AWS) ;0;0;0;1
 Develop and deploy new services for the Adobe Cloud Platform ;0;0;0;1
 Die aktuell stattfindende grundlegende Modernisierung unserer Software auf dem Weg in die Cloud ermöglicht dir eine gute Einarbeitung durch intensive Einblicke in den Funktionsumfang sowie die unterstützten Fachprozesse und bringt dich so weiter voran - Als ein führender europäischer Anbieter von Finanz- und Vorsorgelösungen unterstützen wir mit Leidenschaft Menschen, finanziell für sich zu sorgen – ein Leben lang. ;0;0;0;1
 Die Entwicklerplattform basiert auf der offenen Technologie von Cloud Foundry und läuft auf IBMs Softlayer-Cloud-Infrastruktur;0;0;0;1
 Du arbeitest an dem Aufbau einer hochperformanten Cloud-Plattform auf Basis von OpenStack mit Fokus auf die Bereitstellung von Compute Ressourcen wie zum Beispiel Grafikarten und virtuellen Maschine mit unterschiedlicher Architektur mit ;0;0;0;1
 Du arbeitest eng mit dem zusammen, um die Integration von Betriebssystemen in Cloud-Infrastrukturen sicherzustellen ;0;0;0;1
 Du berücksichtigst IT-Sicherheit bei der Weiterentwicklung deiner Cloud-Lösungen und im Betrieb und hast Kenntnisse über verbreitete Monitoring-Werkzeuge. Wir suchen dich als Cloud Solution Architect (w|m|d) zur;0;0;0;1
 Du besitzt fundierte Kenntnisse in der Automatisierung von Betriebssystemen, vorzugsweise im Cloud-Umfeld ;0;0;0;1
 Du betreust und betreibst verschiedene technische Systeme zur Bereitstellung der Cloud-Umgebun;0;0;0;1
 Du betreust und betreibst verschiedene technische Systeme zur Bereitstellung der Cloud-Umgebung sowie zum Betrieb der Cloud ;0;0;0;1
 Du bist zuständig für die Umsetzung und das Management von Cloud-basierten Projekten in enge;0;0;0;1
 Du bringst Erfahrung im Umgang mit modernen Cloud-Technologien (z.B. AWS, Azure) und in der Konfiguration von stabilen Netzwerken (Proxy, HTTPS, VPN, etc.) mit ;0;0;0;1
 Du bringst unsere Cloud voran - von der Konzeption bis zur Umsetztung;0;0;0;1
 Du designst und projektierst Lösungen zur Kommunikation von Cloud Native Applikationen über ein Application-Mesh ;0;0;0;1
 Du entwickelst gemeinsam mit deinem Team die für die jeweilige Lösung benötigte Cloud-Infrastruktur unter Verwendung von Infrastructure as Code. Unter der Marke Rexroth entstehen innovative Komponenten, maßgeschneiderte Systemlösungen und Dienstleistungen für mobile Anwendungen, Anlagenbau und Engineering sowie Fabrikautomation. ;0;0;0;1
 Du entwickelst mit deinen im Team neue Datenbank-Plattformumgebungen in der eigenen Cloud-Plattform ;0;0;0;1
 Du entwickelst skalierbare, hoch verfügbare und performante Cloudumgebungen auf Basis von Amazon Web Services (AWS) ;0;0;0;1
 Du entwickelst und optimierst innovative Individualsoftware-Lösungen nach Kundenanforderung in einem interdisziplinär arbeitenden Team - Mit unseren maßgeschneiderten Software-Tools und -Suiten sind wir der ideale Ansprechpartner für diesen Prozess. Weil wir unsere Software konsequent aus Anwendersicht und in Zusammenarbeit mit diesen entwickeln, gilt auch in diesem Sinne: Wir verstehen Bahnhof! ;0;0;0;1
 Du entwickelst, implementierst und wartest Lösungen auf Basis von SAP Commerce Cloud (ehemals Hybris) in Zusammenarbeit mit unseren externen . ;0;0;0;1
 Du entwirfst und setzt automatisierte Prozesse zur Bereitstellung, Konfiguration und Überwachung von Linux / Unix-Systemen in der Cloud um ;0;0;0;1
 Du gestaltest den Entwurf, die Umsetzung und Weiterentwicklung von hochverfügbaren Cloud Services mit ;0;0;0;1
 Du hast erste Erfahrung mit Health-IT-Projekten in Cloud Umgebungen oder On-Premise und weißt, wie man sie erfolgreich macht und wie man vermeidet, dass sie schief gehen.;0;0;0;1
 Du hast Interesse am agilen Arbeiten im Kontext von Cloud-Lösungen. ;0;0;0;1
 Du hast Kenntnisse im Umfeld von Public-Cloud-Lösungen bzw. das Thema ist dir nicht fremd. ;0;0;0;1
 Du integrierst Lösungen in On-Premise Clouds (CaaS, PaaS) ;0;0;0;1
 Du interessierst Dich für Datenbanken, Cloud-Plattformen (z.B. Azure oder AWS) und die technischen und organisatorischen Herausforderungen, die der Betrieb von Softwaresystemen in der Cloud mit sich bringt ;0;0;0;1
Du berichtest an den Cloud Solutions and Services und leistest einen wichtigen Beitrag für unsere Kunden weltweit, während Du Teil eines etablierten Unternehmens bist, in dem Du Deine Fähigkeiten weiterentwickeln kannst und in dem wir Dir a;0;0;0;1
 Du kannst eine langjährige Erfahrung in der Entwicklung, Design und Beratung von Kunden hinsichtlich Lösungen im E-Commerce-Umfeld auf Basis von SAP Commerce Cloud (Hybris) nachweisen. ;0;0;0;1
 Du planst und entwickelst Azure Cloud-Infrastrukturen und Applikationsarchitekturen ;0;0;0;1
 Du planst, konzipierst und implementierst innovative Lösungen im Umfeld SAP Commerce Cloud mit dem Ziel, die Geschäftsprozesse sowie Customer Experience im Bereich Marketing und Sales zu optimieren. ;0;0;0;1
 Du stellst die Erweiterung einer cloudbasierten Infrastruktur (Public- und Hybrid Cloud) sicher ;0;0;0;1
 Du testest und betreibst unsere innovativen Anwendungen in Cloud-Umgebungen (Kubernetes) ;0;0;0;1
 Du übernimmst die Beratung großer Cloud Umsetzungsprojekte als Enterprise Cloud Solution A;0;0;0;1
Tiefe praktische Erfahrung in Implementierung von Use Cases mit Microsoft Azure Synapse Analytics (Datenintegration, ETL, etc.) und Power BI Cloud sowie in der Anwendung anderer Services (z.B. Machine Learning);0;0;0;1
 Du unterstützt bei der Optimierung des Cloud Datawarehouse hinsichtlich Performance und Skalierbarkeit ;0;0;0;1
 Du unterstützt den Aufbau einer hochperformanten Cloud-Plattform ;0;0;0;1
 Du unterstützt den Aufbau weiterer Datenbank-Services auf unserer Cloud-Plattform ;0;0;0;1
 Du verantwortest die Cloud-Architektur & Integration und stimmst diese mit den Stakeholdern ab. ;0;0;0;1
 Eines der Ziele war vor allem eine Umgebung zu schaffen, mit der sich mobile und Cloud-Anwendungen schnell aus Bausteinen zusammensetzen, mit Code-Schnipseln individualisieren, automatisiert testen sowie auf Knopfdruck installieren und aus der Cloud betreiben lassen;0;0;0;1
 Entwerfen und Pflegen: Erarbeitung von eventbasierten Pipelines, die unsere On-Premise Welt mit der Public Cloud verbinden ;0;0;0;1
 Entwickeln und betreiben von Applikationen in der Cloud (Java, Terraform, Kubernetes, Vue.js) Hierzu gehört das Automatisieren wiederholender Prozesse durch die Entwicklung von Self Services genauso wie das Reviewen von bestehenden Cloud Applikationen aus Zuverlässigkeits- und Kostensichtpunkten. ;0;0;0;1
 Entwicklung von bestehenden und neuen, innovativen Lösungen im IoT- und Cloud-Umfeld - Mit Ihrer zielstrebigen und zukunftsweisenden Art finden Sie sich schnell in neue Sachverhalte ein und finden die passende Lösung. ;0;0;0;1
 Entwicklung von maßgeschneiderten Softwarelösungen zur Steuerung logistischer Prozesse unserer namhaften Kunden ;0;0;0;1
 Entwicklung von Software für CNC- Maschinen - o Entwurf und Implementierung der Windows- Software ;0;0;0;1
 Entwicklung von spezialisierten Softwarekomponenten für die Datenverarbeitung in Embedded-, Edge- und Cloudumgebungen ;0;0;0;1
 Erarbeitung komplexer Lösungen im Team und entsprechend eines ISO-zertifizierten Entwicklungsprozesses - o Design der Software in Zusammenarbeit mit dem;0;0;0;1
 Erfahrung in erfolgreich umgesetzten Projekten im Public Cloud Umfeld, ideal;0;0;0;1
 Erfahrung mit Cloud-Technologien (Kubernetes, Docker). ;0;0;0;1
 Erste Erfahrungen im Umgang mit Lösungen und Prozessen bei mindestens einem Hyperscaler (AWS, Microsoft Azure oder Google Cloud Platform) Cloud Computing ist die Zukunft und die damit verbundene Transformation für unsere Kunden unumgänglich. ;0;0;0;1
 Erste Kenntnisse in der Entwicklung von Backend-Anwendungen und Webservices in der Cloud (z.B. AWS);0;0;0;1
 Es konkurriert dabei gegen vergleichbare Angebote wie Google App Engine oder die Elastic Compute Cloud von Amazon;0;0;0;1
Umsetzung neuer Cloud-Technologien. ;0;0;0;1
 Evaluierung neuer Cloud-Technologien. ;0;0;0;1
 Expertise in der Verwendung von Cloud Services (bevorzugt auf GCP, Azure, OpenStack) ;0;0;0;1
 Fundierte Kenntnisse der Anforderungen für die Migration von Anwendungen vom Rechenzentrum in die Cloud.;0;0;0;1
 Für diese Aufgabe bringst Du Erfahrungen in der Planung und Realisierung von DevOps-Projekten auf Cloud Plattformen mit.;0;0;0;1
Als Firmware Engineer unterstützt Du hierbei die Entwicklung moderner Cloud-Lösungen;0;0;0;1
 Gute Kenntnisse im Cloud Umfeld (z.B. GCP, AWS oder Azure);0;0;0;1
 Gute Kenntnisse und Erfahrungen im Betrieb von verteilten AWS Cloud Infrastrukturen ;0;0;0;1
 Heute ist insbesondere die Servervirtualisierung im modernen Rechenzentrumsbetrieb stark verbreitet;0;0;0;1
 Idealerweise Zertifizierungen in Cloud-Technologien und -Lösungen in der Azure / Microsoft-Domäne sowie technisches Verständnis moderner IT-Architekturen zur Nutzung von Cloud-Lösungen ;0;0;0;1
 In deiner Rolle als Cloud Solution Architect (m/w/divers) gestaltest du die Cloud- und Analytics-Strategie für Materials Services mit ;0;0;0;1
