Sonstiges;Zusammenarbeit anderer Teammitglieder Innovation vorantreiben Fehlentwicklung vermeiden
Sonstiges;Affinitaet Fuer ecommercebereich
Softwareentwicklung im E-Commerce;Webentwicklung Ecommerce Javascript
Softwareentwicklung im E-Commerce;Agentursteuerung seo sea Steuerung Shopsoftware Appentwickler
Softwareentwicklung im E-Commerce;Berufserfahrung Bereich Ecommerce idealerweise Plattformen
Softwareentwicklung im E-Commerce;kommn Board -- gestalen Zukunft Ecommerce 
Softwareentwicklung im E-Commerce;Unternehmen benoetigen Fuer Betrieb Ecommerceplattform global verteilt Rechenzentren hochverfuegbar dienste Schnittstell anderer Anwendung
Softwareentwicklung im E-Commerce;Unternehmen vertreiben Warensortiment ueberwiegend ueber Online Bzw Mobile Shop Kataloge
Softwareentwicklung im E-Commerce;Herz schlaegen Fuer Ecommerce Onlineshopping Amazon
Softwareentwicklung im E-Commerce;about -- holding se eigenschreibweise about -- deutsch Internethaendler Fuer Bekleidung schuhen accessoir Sitz Hamburg
Softwareentwicklung im E-Commerce;demandwareshopsoftware Softwareasaserviceloesung
Softwareentwicklung im E-Commerce;Firma entwickeln vertreiben ecommercesoftware Fuer Onlinehaendler
Softwareentwicklung im E-Commerce;Idee elektronisch Buchgeschaeft entstehen Investor David e
Softwareentwicklung im E-Commerce;Weiterentwicklung Ecommerce Loesungen national international Markt Crossfunktionaler Ausrichtung Bereich projektarbeit Projektmanagement Berichtswesen Analyse
Softwareentwicklung im E-Commerce;partneraddons erstrecken detailliert Projektmanagement Webshops
Softwareentwicklung im E-Commerce;arbeitest aktiv Steuerung Betreuung Ausbau Vertriebskanael lernen Projektorientierte Arbeitsweise Ecommerce kennen
Softwareentwicklung im E-Commerce;Fullstackentwicklerin verantwortlich fuer Entwicklung Nutzung Rest apis fuer frontend Backendentwicklung Bezug Kapazitaetsmanagementtool
Softwareentwicklung im E-Commerce;Onlinewelt zuhause Affinitaet Ecommerce Marketingthemen
Softwareentwicklung im E-Commerce;erhaeltst spannend einblicke Onlinemarketingabteilung renommiert Ecommerce Unternehmen
Softwareentwicklung im E-Commerce;erstellen pflegst Content Bild Text Produktdat Fuer diverser Ecommerce Kanael
Softwareentwicklung im E-Commerce;kennen kpis Ecommerce Plattform Produkt analysierstn Leitest Massnahme
Softwareentwicklung im E-Commerce;unterstuetzen Planung Steuerung Durchfuehrung Crossfunktionalen ecommerceprojekt Uebernimmst selbststaendig klein Projekt
Softwareentwicklung im E-Commerce;unterstuetzen Bereich Ecommerce Amazon anderer Plattform Bereich Online offlin marketing eg Sportmarketing Produkteinfuehrungen prinen Online kampagnen
Softwareentwicklung im E-Commerce;weissen worauf Bewirtschaftung Ecommerce Plattform ankommen kennsen rechtlich gestalterisch Rahmenbedingung
Softwareentwicklung im E-Commerce;wirksen Weiterentwicklung international Ecommerce Strategie Entwicklung neu Idee
Softwareentwicklung im E-Commerce;Durchfuehrung verschieden Recherche analysen Herausforderung potenzial innerhalb ecommercekontext identifizieren
Softwareentwicklung im E-Commerce;Ecommerce Leidenschaft
Softwareentwicklung im E-Commerce;Entwicklung Optimierung Automatisierung Reports Tools Fuer Management Ecommerceteam z b Newsletterperformance Kundencrmkpis Marketingeffizienz
Softwareentwicklung im E-Commerce;Erfahrung Umgang Sap Commerce Vorteil
Softwareentwicklung im E-Commerce;praktisch Erfahrung digital Marketing Kommunikationsumfeld Bereich Ecommerce Marketing Hilti Gruppe beliefern Bau Energieindustrie weltweit technologisch fuehrend Produkt systemloesung Software Serviceleistung
Softwareentwicklung im E-Commerce;gemeinsam Team bringstn geschaeftskritisch System fuer erfolgreich Ecommerceplattforme Deutschland Rennen
Softwareentwicklung im E-Commerce;idealerweise Berufserfahrung Ecommerce
Softwareentwicklung im E-Commerce;Aufgabe Entwicklung softwareloesung insbesondere services webbasierend Loesunge Basis Microsoft net
Softwareentwicklung im E-Commerce;neu Job drehen Entwicklung objektorientiert technologisch anspruchsvoll Netanwendung
Softwareentwicklung für Cloud-Lösungen;Integration Commerce Loesung anderer Cloud Anwendung Kunde gehostet Anwendung ueber z b Apis Erp Backends integrationsmiddlewar Payment System Content Delivery networks uvm
Softwareentwicklung im E-Commerce;Interesse Mitarbeit dynamisch Ecommerce Startup Automobilhandel
Softwareentwicklung im E-Commerce;kontinuierlich Weiterentwicklung Ecommerce Loesungen international Ebene
Softwareentwicklung im E-Commerce;Spaeter Onlineshops Fuer Gartenmoebel sonstig Moebel Nischenshopsystem aufnehmen
Softwareentwicklung im E-Commerce;mehrjaehrig Berufserfahrung Softwareentwicklung Kenntnisse Webentwicklung zb typescript angular
Softwareentwicklung im E-Commerce;koenn klein mittelstaendisch Haendler mittlerweile konzern Onlineshops erstellen
Softwareentwicklung im E-Commerce;koenn klein mittelstaendisch Haendler mittlerweile konzern Onlineshops erstellen Logistik auslagern
Softwareentwicklung im E-Commerce;Planung Konzeption Leitung ecommerceprojekt Fuer online Shop Zusammenarbeit entwicklern
Softwareentwicklung im E-Commerce;Entwicklung webbasiert Bedienoberflaech html Javascript
Softwareentwicklung im E-Commerce;Realisierung Weborientierten Application
Softwareentwicklung im E-Commerce;entwickeln Programm Sapumfeld abap
Softwareentwicklung im E-Commerce;uebernehmen Verantwortung Fuer Konzeption Planung Umsetzung innovativ Weiterentwicklung bestehend potenziell neu System Ecommerceumfeld
Softwareentwicklung im E-Commerce;solve Technical Challenge the field -- Ecommerce with Uptodate methods patterns -- technologies
Softwareentwicklung im E-Commerce;Steuerung Unterstuetzung Ecommercevertriebspartner markenauftritt Portfolios Webshops optimieren
Softwareentwicklung im E-Commerce;strategisch Weiterentwicklung gesamt Online Digitalgeschaefts Tom Tailor -- insbesondere analytisch Weiterentwicklung digital Ecommercekanaele crm
Softwareentwicklung im E-Commerce;Unterstuetzung Konzeption Umsetzung Prozessablaeufe Ecommerce digital Transformation insbesondere innerhalb backendprozesse unterschiedlich Microservices
Softwareentwicklung im E-Commerce;Unterstuetzung unterschiedlich Ecommerce Team Steuerung operativ Thema
Softwareentwicklung im E-Commerce;Weiterentwicklung Unterstuetzung Betreuung Ecommerce Accounts
Softwareentwicklung im E-Commerce;raiffeis Warengruppe erfolgreich Handel Serviceunternehmen Deutschland zusaetzlich Standort Daenemark Polen
Softwareentwicklung im E-Commerce;Zalando mehrere geschaeftsfeldern aktiv -- Onlineshop ueber Eigenmark Shoppingclub zalando Lounge outlets deutsch Staedt Beratungsservice Zalon Logistik marketingangebote Fuer Haendler
Softwareentwicklung im E-Commerce;Verstaerkung Team Standort Hamburg Remote Bzw Homeoffice suchen Vollzeit Senior Data Analyst Mwd Ecommerce crm
Softwareentwicklung im E-Commerce;codeitlabs Gmbh bieten knapp Entwicklungsloesungen Ecommerce Bereich Fuer verschiedenst Branche Schmuckware ueber Chemie food Einzelhandelsindustrie innerhalb Dachregion
Softwareentwicklung im E-Commerce;Hilfe Javabasierten Spring Apis Commerce Cloud Loesunge macharchitektur Microservice Api Cloud Headless -- Composen -- individuell ecommerceprojekte
Softwareentwicklung im E-Commerce;beruflich Erfahrung Softwaredeveloperin Java ee spring
Softwareentwicklung im E-Commerce;Ecommerce Experte Mwd fuer umfassend Betreuung Optimierung online Shop Mediq Rezept app verantwortlich
Softwareentwicklung im E-Commerce;Entwickler Kuemmerst neu Webshoploesung
Softwareentwicklung im E-Commerce;Entwickler phpshopsystem Mwd handeln entscheiden selbststaendig Rahmen speziell Projekt
Softwareentwicklung im E-Commerce;#NAME?
Softwareentwicklung im E-Commerce;markenuebergreifend Ecommerce Marktplatz bilden Angebot stationaer Autohandel online neu gebrauchtfahrzeug werkstattservices Zubehoer relevant Dienstleistung Bereich Bezahlung Leasing Finanzierung Beratung Praktikant -- Ecommerce mwd
Softwareentwicklung im E-Commerce;Mitglied erfahren Entwicklerteam Entwirfst plansen entwickelen kundenzentriert wertschoepfend neu Feature Fuer komplett Produktbereich Ecommerce Multichannelplattform
Softwareentwicklung im E-Commerce;Multichannelanbieter betreiben Unternehmen Online Bzw Mobile Shop
Softwareentwicklung im E-Commerce;Praktikant mwx Ecommerce growth Strategy unterstuetzen operativ Steuerung strategisch Weiterentwicklung Ecommerce Business
Softwareentwicklung im E-Commerce;Projektleiter leiten international Projektteam setzen komplex digital innovativ Loesunge Ecommerce
Softwareentwicklung im E-Commerce;qualitaetsmanag verantworten qualitaet entwickelt Ecommerce Projekt Effizienz intern Entwicklungsablaeufe
Softwareentwicklung im E-Commerce;sal Assistant mw Team Ecommerce betreuen national international Online Marktplaetzeaccount Tagesgeschaeft tragen wesentlich Ausbau zukunftstraechtigen vertriebskanal
Softwareentwicklung im E-Commerce;Software Engineer praktisch Erfahrung Webentwicklung
Softwareentwicklung im E-Commerce;Softwareentwickler Mwd Brennst fuer zukunftstraechtig Thema Ecommerce
Softwareentwicklung im E-Commerce;Softwareentwickler Mwd Bereich Ecommerce Dienstleistung Softwareloesung
Softwareentwicklung im E-Commerce;Softwareentwickler Schwerpunkt Ecommerce arbeiten Shoptimax fest Projektteam dynamisch ergebnisorientieren Realisierung Projekt Start Produktion Launch Shop gemeinsam umsetzen
Softwareentwicklung im E-Commerce;Softwareentwickler Php neu Team fuer Weiterentwicklung Ecommerce Omnichannelbereich etabliert Unternehmen
Softwareentwicklung im E-Commerce;Solution Architect Ecommerce Mwd treiben Schnittstellenfunktion business -- digital Transformation Service voran
Softwareentwicklung im E-Commerce;Solution Developer Ecommerce Mwd Direktanstellung Auftraggeber Expertise fragen
Softwareentwicklung im E-Commerce;strategisch Wachstumspartner Kunde setzen cloudbasiert Ecommerce Itplattformen modern Automatisierungstechnologie komplex global Supply Chainloesung realisieren
Softwareentwicklung im E-Commerce;Technical Consultant mwd begleitest Projekt Erstberatung Golive betreiben
Softwareentwicklung im E-Commerce;Ecommerce Team Bereich Digital customer experience erstellen Analyse Reports digital Produkt Leitest gemeinsam Team kundenzentriert Handlungsempfehlunge fuer Produktentwicklung Vermarktung
Softwareentwicklung im E-Commerce;Werkstudentin Bereich Ecommerce digital Marketing Fuer Zentraleuropa Dach Region Niederlande Polen unterstuetzen Weiterentwicklung Hilti Website
Softwareentwicklung im E-Commerce;Anbindung Erstellung Schnittstell angrenzend System Webservices Datenbank
Softwareentwicklung im E-Commerce;bieten ganzheitlich Itloesung fuer Kunde bilden gesamt Windowsspektrum
Softwareentwicklung im E-Commerce;Aufgabe Setup Ecommerceschnittstelle
Softwareentwicklung im E-Commerce;Grundlage Hcl Commerce unterschiedlich java frameworks Technologie Einsatz
Softwareentwicklung im E-Commerce;beiten eng interdisziplinaer Team designer entwicklern anderer Fachleute sicherstellen Produkt qualitaetsstandards kundenbeduerfnissen entsprechen
Softwareentwicklung im E-Commerce;Beteiligung Weiterentwicklung Ecommerce Systems Beschaffung daten services Immobilienbewertung frontend backend
Softwareentwicklung im E-Commerce;Softwarearchitektur Steckenpferd lieb Bereich Marketing Cloud Salesforce Adobe experience Google Cloudecommerce
Softwareentwicklung im E-Commerce;darueber hinaus pflegen direkt intensiv Beratung verkaufsprozess Szene Fuer klassisch Fahrzeug -- ueber Ecommerce Plattform ueber persoenlich Engagement jung dynamisch Team
Softwareentwicklung im E-Commerce;studentisch Startup gegruendet Socialcommerceunternehmen stellen nutzer Marke Spreadshirt Onlineplattform Verfuegung Hilfe tshirts gestalten kaufen ueber Marktplatz Verkauf anbieten Koenn
Softwareentwicklung im E-Commerce;Unternehmen betreiben deutsch Onlineshops Aboutyou
Softwareentwicklung im E-Commerce;Unternehmen betreiben deutsch Onlineshops Aboutyoude Editedde Aboutyoushoppingapp Parallel anbieten europaeisch Laender aktiv
Softwareentwicklung im E-Commerce;Unternehmen betreiben Webseit Sprache deutsch englisch franzoesisch arabisch chinesisch koreanisch Spanisch liefern laut Angabe ueber Laender
Softwareentwicklung im E-Commerce;Demandwar Salesforce commerce Cloud usamerikanisch Softwareanbieter Fuer ecommerceshopsystem
Softwareentwicklung im E-Commerce;web Mobiletechnologie Kernkompetenz
Softwareentwicklung im E-Commerce;deutsch Webshop Unternehmen online
Softwareentwicklung im E-Commerce;Onlineshop Aboutyoude entstehen Rahmen Ecommerceprojekt Collin Juni Otto Group Benjamin Otto heutig Geschaeftsfuehrung Leben rufen
Softwareentwicklung im E-Commerce;Onlineshop bieten Kleidung Schuh Tasche accessoir Echtschmuck designer Valentino Balenciaga Gucci saint Laurent
Softwareentwicklung im E-Commerce;entwickelst selbststaendig neu Funktion fuer Ecommerceplattform verbesseren vorhanden Feature
Softwareentwicklung im E-Commerce;dsb ebusiness Beratung Bereich Ecommerce spezialisieren
Softwareentwicklung im E-Commerce;Geschaeftsidee Ebay bestehen Internetplattform Fuer Verkauf beliebig Verfuegung stellen
Softwareentwicklung im E-Commerce;Hellmann worldwide Logistics germany Gmbh Co kg stellen Ecommerce Bereich professionell Loesunge services Fuer elektronisch Handel dar
Softwareentwicklung im E-Commerce;Otto Gmbh co kg Frueher Otto Versand Gmbh co Otto Group deutsch Handels dienstleistungsunternehmen Sitz Hamburg weltweit Mitarbeiter agieren unternehmensbereich Einzelhandel Finanzierung Logistik Versandhandel aktiv
Softwareentwicklung im E-Commerce;Rewe Group beteiligen September Home erhoffen Vernetzung Ecommerce
Softwareentwicklung im E-Commerce;Website vertreiben international Kleidung schuhen accessoir Fuer damen Herren Kind
Softwareentwicklung im E-Commerce;zalando se Sitz Berlin Boersennotierter deutsch Onlineversandhaendler Fuer Schuh Kleidung Kosmetik
Softwareentwicklung im E-Commerce;beherrschsen Konfiguration Shopify Appeinstellung
Softwareentwicklung im E-Commerce;betreusen technisch Infrastruktur ecommerceprojekt Shopify plus
Softwareentwicklung im E-Commerce;Experte aufsetzen Gaengiger ecommerceplattformen Shopify plus
Softwareentwicklung im E-Commerce;leidenschaftlich Softwareentwickler Entwicklung neu ecommerceanwendung hochwertig strukturiert Code Php aufgehen
Softwareentwicklung im E-Commerce;entwickelen bestehend Eshops
Softwareentwicklung im E-Commerce;entwickelen komplex Ecommerceloesunge Basis Java
Softwareentwicklung im E-Commerce;entwickelstn neu Ecommerceanwendung Shopframework Spryker Sylius Magento Shopware
Softwareentwicklung im E-Commerce;entwickelst qualitativ hochwertig strukturiert Code Php bringstn neu Feature ei
Softwareentwicklung im E-Commerce;gestaltest Hochfrequent Webservices sowohl backend Php symfony frontend Vuejs
Softwareentwicklung im E-Commerce;kenntnisse mindestens shopsyst Spryker Sylius Magento shopware opencart
Softwareentwicklung im E-Commerce;moechtest lernen worauf Ecommerce Produktmanagement Webshopentwicklung ankommen Zukunft digital Ticketing mitgestalten
Softwareentwicklung im E-Commerce;unterstuetzen verschieden Technologie Umgebung php Javascript Docker Spryker storyblok wordpress etc
Softwareentwicklung im E-Commerce;verfuegst ueber Shopifykenntnisse Entwicklungserfahrung plugins fuer backend
Softwareentwicklung im E-Commerce;Ecommerce Zukunft mitpraeg fuer namhaft Kunde komplex Systemlandschaft beherrschbar
Softwareentwicklung im E-Commerce;wirksen Analyse technisch fachlich Kundenanforderung erstellen loesungskonzepte
Softwareentwicklung im E-Commerce;ecommerceprojekt eigenstaendig entwickeln
Softwareentwicklung im E-Commerce;Ecoplan Hersteller marktfuehrend Ecommerceloesung Fuer Industrieunternehmen
Softwareentwicklung im E-Commerce;agil Projektmanagement eng Vernetzung Ecommerce Business bilden technisch Rueckgrat online Shop stellen Einkaufserlebnis digital Umfeld sicher
Softwareentwicklung im E-Commerce;usamerikanisch Softwareanbieter Fuer ecommerceshopsystem
Softwareentwicklung im E-Commerce;Partnergemeinschaft firmeneigen Programmier Entwicklungsabteilung geben Moeglichkeit individuell angepasset Loesungen anbieten koennen
Softwareentwicklung im E-Commerce;Unternehmen marktfuehrer Fuer Schuhversand ueber Internet schreiben Million Euro Verlust
Softwareentwicklung im E-Commerce;entwickeln cloudbasiert Ecommerce Loesung Bereich Shop Experience Fulfillment Masterdata Management
Softwareentwicklung im E-Commerce;Entwicklung Individualsoftware insbesondere frontend
Softwareentwicklung im E-Commerce;Entwicklung Single page applicationsprogressiv web apps unterschiedlich Programmiersprach
Softwareentwicklung im E-Commerce;Entwicklung spannend innovativ Onlineshops Ecommerceloesunge Basis Shopware
Softwareentwicklung im E-Commerce;Entwicklungsaufgaben Umfeld Ecommerceaktivitaet Zusammenarbeit intern extern entwicklungseinheit
Softwareentwicklung im E-Commerce;Erfahrung Umgang Shopware Vorteil
Softwareentwicklung im E-Commerce;fundiert kenntnis html Css Javascript Framework
Softwareentwicklung im E-Commerce;Fuer nachhaltig Wachstum Onlinegeschaefts suchen fuer Ecommerce Team erfahren Spezialistin international Rollout Webshops mitwirken
Softwareentwicklung im E-Commerce;fuer neu Marke Petrhein Produkt smart Haustierbedarf suchen talentiert engagiert Ecommerce Plattform specialisen mwd Fuer Weiterentwicklung Onlinepraesenz Erfolg verschieden Plattform verantwortlich
Softwareentwicklung im E-Commerce;Fuer unternehmenszentral Coesfeldlette Muenster suchen zunaechst befristen quality Engineer Ecommerce --
Softwareentwicklung im E-Commerce;gestalten Aufgabenbereich Detail eigenverantwortlich entwickeln Shoplandschaft Franz Mensch zukunftsorientiern
Softwareentwicklung im E-Commerce;Herbst Launchte Flaconi Flaconiat Oesterreich
Softwareentwicklung im E-Commerce;Deutschland gehoert Bonprix groesster Onlineshops belegen Ehiranking umsatzstaerkst Onlineshops Platz Hauptproduktsegment Mode
Softwareentwicklung im E-Commerce;namenhaft Unternehmen treiben gemeinsam Entwicklerteam Wachstum Onlineshops weltweit voran arbeiten backend
Softwareentwicklung im E-Commerce;abwechslungsreich Position programmieren anspruchsvoll webapplikationen Umfeld Ecommerce
Softwareentwicklung im E-Commerce;Itprojektleiter Softwareentwicklung Ecommerce
Softwareentwicklung im E-Commerce;Java Kotlin Developer Marketing Ecommerce
Softwareentwicklung im E-Commerce;Junior Softwareentwickler Fuer Ecommerce Mwd
Softwareentwicklung im E-Commerce;Kenntniss System Sap Commerce
Softwareentwicklung im E-Commerce;Koordination Entwicklung individuell Kundenanforderung
Softwareentwicklung im E-Commerce;kreativ zukunftsfaehig Idee technisch umsetzen Kundschaft Online begeistern einkaufen wichtig Aufgabe Ecommerce --
Softwareentwicklung im E-Commerce;Magento onlineshopsoftwar erstmals Maerz Opensourceecommerceplattform veroeffentlichten
Softwareentwicklung im E-Commerce;Magento onlineshopsoftwar Version erstmals Maerz Opensourceecommerceplattform veroeffentlichen
Softwareentwicklung im E-Commerce;Magento zaehlen laut Studie Wtechs meist verwendet onlineshopsoftwares stehen wobei klar Anteil Version gegenueber Version
Softwareentwicklung im E-Commerce;Migration gesamt Anwendung Microsoft Softwareplattform Net
Softwareentwicklung im E-Commerce;Mind Erfahrung Bereich Ecommerce Onlinemarketing
Softwareentwicklung im E-Commerce;Programm Connected Retail binden zalando knapp geschaefen stationaer Einzelhandel Modeplattform
Softwareentwicklung im E-Commerce;fest Team ueber Person Erfahrung Ecommerce ueber umgesetzt Onlineshops setzen anspruchsvoll Projekt Souveraen
Softwareentwicklung im E-Commerce;hundert Entwickler Mwd klein agil Team Website
Softwareentwicklung im E-Commerce;net Dachmarke Fuenf international agierend Ecommerceplattform Sitz Leipzig
Softwareentwicklung im E-Commerce;November Magento neu Softwarearchitektur aehnlich Technologiestack veroeffentlichen
Softwareentwicklung im E-Commerce;Datenbank backend frontend -- vielseitig Softwareentwickler stemmen Stack Onlineshop
Softwareentwicklung im E-Commerce;programmieren Fuer web entwickeln neu Softwareloesung Webentwickler Leib Seele fuer Welt ecommerce begeistern
Softwareentwicklung im E-Commerce;Online Moebelhaus Gmbh suchen php Spezialist
Softwareentwicklung im E-Commerce;Otto erfolgreich ecommerceunternehmen Europa
Softwareentwicklung im E-Commerce;Rewe Ecommerce buendeln Onlinegeschaeft Dach entwickeln Gesamtkonzept Belieferung Kunde Onlinebestellungen Lebensmittel Heimtierbedarf
Softwareentwicklung im E-Commerce;kenntnis objektorientiert Programmierung speziell php mysql
Softwareentwicklung im E-Commerce;November bieten about -- Ecommerceinfrastruktur Software Fuer Betrieb Webshops Lizenzprodukt fuer anderer Onlinehaendler
Softwareentwicklung im E-Commerce;September deutsch Ecommerce Unternehmen Flaconipl Polen vertreten
Softwareentwicklung im E-Commerce;Shopify proprietaer Ecommercesoftware gleichnamig kanadisch Unternehmen vertreiben
Softwareentwicklung im E-Commerce;Shoptimax Nuernberger ecommerceexpert Fuer Implementierung Optimierung Onlinevertriebskanael Integration Erp pimsystem ua Sap Microsoft nav Ax plentymarkets Tosca Jcatalog uva
Softwareentwicklung im E-Commerce;designen Weboberflaechen aktuell Massstaeben stets Blick Schnittstell Backend
Softwareentwicklung im E-Commerce;profitieren weltweit einkaufsquell Erfahrung Kontakt nutzen Onlineshops fuer individuell Beschaffung
Softwareentwicklung im E-Commerce;softwareentwickl Ecommerce mw
Softwareentwicklung im E-Commerce;Softwareentwickler Ecommerce backend
Softwareentwicklung im E-Commerce;Softwareentwickler Ecommerce backend php
Softwareentwicklung im E-Commerce;Softwareentwickler Php Backend Ecommerce Spryker
Softwareentwicklung im E-Commerce;Softwareentwickler Salesforce Bb Commerce
Softwareentwicklung im E-Commerce;Softwareentwickler Salesforce Bb commerce mwd
Softwareentwicklung im E-Commerce;Softwareentwicklerin Webentwicklerin backend
Softwareentwicklung im E-Commerce;spread group rufname sprdnet Dachmarke Fuenf international agierend Ecommerceplattform Sitz Leipzig
Softwareentwicklung im E-Commerce;Steuerung Shopsoftware Appentwickler
Softwareentwicklung im E-Commerce;Wachstum gerecht suchen engagiert Mitarbeiter Fuer Ecommerce Kundendienst
Softwareentwicklung im E-Commerce;Desktopapplikation wesentlich Bestandteil Pim mam Cmsloesung
Softwareentwicklung im E-Commerce;Softwarelsung untersttzen Kunde smtlich Produktdat zentral Stelle finden bearbeiten fr Verkaufskanle bereitstellen
Softwareentwicklung im E-Commerce;web Applicationentwicklung
Softwareentwicklung im E-Commerce;Webentwicklung
Softwareentwicklung im E-Commerce;Webentwickler phpecommerce Mwd Shopware
Softwareentwicklung im E-Commerce;Westwing Ecommerceplattform fuer home living
Softwareentwicklung im E-Commerce;bieten Hardware softwareloesung Fuer Ecommerce Omnichannel erp kundenspezifisch Warenwirtschaft Warehouse Management System Kassensystem
Softwareentwicklung im E-Commerce;entwickeln fuer Kunde umfangreich Eshoploesung
Softwareentwicklung im E-Commerce;entwickeln implementieren betreuen Noetig prozeß Schnittstelle Anwendung modern Bestellplattform mussn
Softwareentwicklung im E-Commerce;realisieren spannend Projekt Fuer namhaft Anbieter Entwickler Itloesung entwickeln fuer Kunde vielfaeltig massgeschneidert Anwendung Websites desktopsoftwaren nativ App Webapp
Softwareentwicklung im E-Commerce;digital Autohaus Zukunft Handel Fuer Handel entwickelt Softwareasaserviceloesung
Softwareentwicklung im E-Commerce;groesste ecommerceunternehmen Ruhrgebiet Deutschland Fuehrender onlinespezialist Fuer baby Kinderausstattung
Softwareentwicklung im E-Commerce;ecommerceunternehmen muenchn Westen Verkauf hochwertig Designermoebel spezialisieren
Softwareentwicklung im E-Commerce;jung Softwareunternehmen Entwicklung individuell Anwendung Bereich web mobil App spezialisieren
Softwareentwicklung im E-Commerce;global Onlinemarktplatz Fuer luxusuhren
Softwareentwicklung im E-Commerce;suchen Data Insights Specialist Ecommerce Mwd
Softwareentwicklung im E-Commerce;suchen engagiert Technical Consultant mwd Fuer komplex webanwendungen apps Ecommerce System Webplattform
Softwareentwicklung im E-Commerce;suchen Frontendentwickler Fuer ecommerce Plattformen
Softwareentwicklung im E-Commerce;suchen web Developer Programmierer Mwd neu Idee arbeiten
Softwareentwicklung im E-Commerce;vereinen Besonderheit bb Handel Anforderung technisch anspruchsvoll Produkt Automatisierungsindustrie
Softwareentwicklung im E-Commerce;naechstmoeglich Termin suchen Qualitaetsmanager wm Fuer entwicklungsprojekte Bereich Ecommerce
Softwareentwicklung im E-Commerce;Verstaerkung Street one Designteam Isernhag Hannover suchen naechstmoeglich Zeitpunkt Junior Designer Mwd Bereich Ecommerce sondervermarktungen
Softwareentwicklung im Bankensektor;Unternehmen Fuer Abwicklung beleglosen Zahlungsverkehr
Softwareentwicklung im Bankensektor;Crealogix bieten verschieden -- digital banking -- Produkt Fuer Finanzindustrie online mobil Banking System online Banking security finance Portal Digital Financial advisory Tools
Softwareentwicklung im Bankensektor;Crealogix Epayment Loesunge bieten Multibankanbindung Hilfe Fuer Firma vereinen Zahlungsverkehr Saasloesung
Softwareentwicklung im Bankensektor;Crealogix entwickeln implementieren finanztechnologieloesung Fintech fuer Bank
Softwareentwicklung im Bankensektor;handeln Software Bereich Kredit Anlage Wertpapierberatung
Softwareentwicklung im Bankensektor;wesentlich Schwerpunkt Gesamtbanksteuerung Risikomanagement aufsichtsrecht meldewesen payments Produktberatung Kalkulation
