Sonstiges;Amazon Boersennotierter usamerikanisch Global agierend Onlineversandhaendler breit gefaechert Produktpalette
Sonstiges;abgeschlossen Studium Wirtschaftsinformatik Softwareentwicklung vergleichbar Qualifikation
Sonstiges;abgeschlossen Studium Informatik Wirtschaftsinformatik Softwareengineering vergleichbar Ausbildung
Sonstiges;abgeschlossen Studium ittechnisch Ausbildung z b Fachinformatiker mehrjaehrig Berufserfahrung Softwareentwicklung
Sonstiges;abwechslungsreich Aufgabe Gestaltungsspielraum hochtechnologisch Cloudumfeld
Sonstiges;Datenanalysen durchfuehren Hypothese Handlungsempfehlung Fuer Digital Commerce Einkauf Marketing ableiten
Sonstiges;Adaption Design Softwarearchitektur
Sonstiges;Administration bestehend aws Cloud Umgebung
Sonstiges;Administration azurekomponenten monitoring notwendig prozeß
Sonstiges;Affinitaet Automatisierungstechnik Umsetzung
Sonstiges;agil Entwicklung abwechslungsreich innovativ softwareprojekten Fuer Branchenfuehrer
Sonstiges;agil Softwareentwicklung z b Kanban Scrum
Sonstiges;agil Softwareentwicklung Scrum
Sonstiges;agil Mindset loesungsorientierte denkweise Freude Arbeit agil Team z b Scrum
Sonstiges;agil Projektmanagement projektbezogen Softwareteilprodukt
Sonstiges;aktiv Mitarbeit Implementierung Ausfuehrung operativ strategisch Ecommerce Projekt
Sonstiges;aktiv Mitarbeit Embeddedsoftwareprojekte
Sonstiges;aktiv Mitgestaltung gesamt Softwareentwicklungsprozess Anforderungsanalyse ueber Design Implementierung Qualitaetssicherung permanent Weiterentwicklung bestehend Softwareanwendung
Sonstiges;Business intelligence Engineer Verantwortest Entwicklung Optimierung etl Datenfluessen Data Warehouse Basis Bankfachliche technisch Anforderung
Sonstiges;Softwareentwickler Mwd unterstuetzen Analyse fachlich Anforderung Arbeitest Konzeption Umsetzung neu Softwarefunktione Komponente
Sonstiges;Softwareentwickler schwerpunkt Testkonzept Automatisierung Wmdiv
Sonstiges;zustaendig fuer Ableitung Definition Massnahme Verbesserung softwarequalitaet Testaktivitaet
Sonstiges;Team plugin Tools spielen entscheidend Rolle Entwicklung Umsetzung Software Roboteroekosystemen
Sonstiges;zentral Ansprechperson beantworten technisch Frage ecommercebereich Sparringspartner
Sonstiges;Amazon setzen aws Vergabe Ibm anderer Bewerber
Sonstiges;Analyse bestehend Applikation verschieden clouds gcp Azure Openstack
Sonstiges;Analyse Berichterstattung relevant Ecommercekpis Identifizierung Wachstumspotenzial Entwicklung strategisch Massnahmenplaene segmentsproduktserienvertriebspartnereben
Sonstiges;Analyse Optimierung Softwareperformance diverser Drohnenplattforme
Sonstiges;Analyse Anforderung Ausarbeitung Schaetzbare Item
Sonstiges;Analyse Anforderung Kunde Design passend Loesungen
Sonstiges;Analyse Software Systemanforderung inklusive safety
Sonstiges;Analyse Konzeption Programmierung Softwareprodukt sap Anwendungsentwicklung objektorientiert Hochsprach C Java c
Sonstiges;analytisch Faehigkeit hohes Abstraktionsvermoeg
Sonstiges;analytisch Denkvermoeg Problemloesungskompetenz ausgepraegt Kommunikationsstaerke
Sonstiges;analytisch erfassen Geschaeftsprozesse Umsetzung strukturiert Softwarefunktion
Softwareentwicklung für Cloud-Lösungen;Anbindung cloudsysteme ueber Mqtt Opcua
Sonstiges;Anforderungsanalyse Erstellung Spezifikation Software
Sonstiges;Anforderungsanalyse Softwaresystem Umsetzung Kundenanforderung
Sonstiges;anhand Information bestehend Ecommerce kanaelen Festool leiten datengetrieben Massnahme Entscheidung Fuer international Rollout setzen gemeinsam Team
Sonstiges;Anwender Koenn Sap bereitgestellt Software development kit Applikation individuell fuer Kunde Fuer mehrere Kunde bauen ueber Sapstore bereitstellen
Sonstiges;Anwendungsentwicklung Fuer Linux Windows c c php
Sonstiges;Arbeit System fuer Softwareversionierung kontinuierlich Integration ci
Sonstiges;Design Implementierung Test angrenzend Produkt zb Kundenportal 
Sonstiges;mal ausprobieren Aufbau Konfiguration Wartung Cloud Komponent
Sonstiges;Aufbau maximal Automatisierungsgrad Betrieb Anwendung Amazon Cloud Verwendung Infrastructureascode z b aws Cdkterraform
Sonstiges;aufgeschlossen Persoenlichkeit selbstaendig loesungsorientierte arbeitsweisen
Sonstiges;Ausbildung abgeschlossen Studium Informatik Software Engineering vergleichbar Qualifikation
Sonstiges;Ausbildung abgeschlossen Studium Fachrichtung Informatik Software Engineering abschließen vergleichbar Qualifikation
Sonstiges;Ausbildung erfolgreich abgeschlossen Studium Fachrichtung Wirtschaftsinformatik wirtschaftsingenieurwesen vergleichbar idealerweise Bezug Cloudcomputingdatenplattformen
Sonstiges;ausgepraegt Affinitaet Ecommerce Trend Technologie analytisch Faehigkeit Teamgeist Verbindung Ergebnisorientierung runden Profil
Sonstiges;Ausgestaltung technologisch Roadmap nachhaltig Softwarearchitektur
Sonstiges;Auslegung Implementierung Drehzahl Drehmomentregelkreis
Sonstiges;arbeiten eng System Softwarearchitekt effektiv Integration tests Gewaehrleist
Sonstiges;Bachelor Bzw Diplommasterabschluss Fachrichtung Bet
Sonstiges;Bearbeitung Kundenanfrag per Email Telefon Chat
Sonstiges;Begeisterung Fuer Softwareentwicklung Freude abwechslungsreich Aufgabengebiet
Sonstiges;Begleitung Softwareentwicklungsprozesse Anforderungsanalyse ueber Architektur Design Implementierung Testen Softwarekomponent
Sonstiges;Beratung bzgl Intrexx Cloud fuer Kunde Partner
Sonstiges;Beratung intern Kundenteam gemeinsam Suche Loesungen Fuer komplex Herausforderung
Sonstiges;waehrend Entwicklung treffen Vorkehrung Softwareapplikation sichern produktiv setzen koennen einfach Betreuung laufend Betrieb ermoeglich
Sonstiges;Bereitstellung Adhocanalysen Erkenntnis Empfehlung Verbesserung Kampagne Onsite Performance effektivitaet Onlineerfahrung Leistung Ecommercegeschaeft steigern
Sonstiges;Berufseinsteiger Leidenschaft Fuer Softwareentwicklung industriell Umfeld Young Professionals Erfahrung Softwareprodukt Fuer komplex instrumente
Sonstiges;Berufserfahrung Bereich manuell automatisiert Softwaretesten
Sonstiges;bestmoeglich Platzierung Produkt Onlineshop
Sonstiges;Betreuung Mitgestaltung gesamt softwarelifecycl
Sonstiges;Betreuung Softwareprodukt Rahmen Itsicherheit
Sonstiges;business one Guitechnik Plattformgebund laeuft derzeit Microsoft Windows
Sonstiges;Changemanagement Support bestehend Softwareprojekt
Sonstiges;Clean Code Softwarecraftsmanship fremdwort fuer
Sonstiges;Finanzit Sparkassenfinanzgruppe gehoert anderer Marktposition Sparkasse staerken
Sonstiges;arbeiten modern Software Java ee gestalten aktiv bestehend Itsystem Mehrschichtarchitektur basieren
Sonstiges;arbeitestn Kundenwunsch gibst bestes Anforderung Kunde Software umsetzen
Sonstiges;Fuer Installation upgrade patchen Applikation Java Windows Umfeld Fuer Weiterentwicklung Implementation neu Technologie infastructure as code 
Sonstiges;decken komplett Softwareentwicklungsprozess Analyse Konzeption ueber Umsetzung Produktivsetzung
Sonstiges;erstellen Softwarearchitektur Design fuer Implementierung Testung zustaendig
Sonstiges;helfen kenntnis Verwaltung softwareprojekten zb git mav Gradle testgetrieben Entwicklung
Sonstiges;leistesen wichtig Beitrag Backendbzw Frontendentwicklung Softwareloesung
Sonstiges;fuer strukturierteobjektorientiert Softwareentwicklung cc verantwortlich
Sonstiges;verantwortesen softwareschnittstell neu Generation off Road Robotic steuergeraen
Sonstiges;kaufmaennisch logistisch Software Fuer vieler unterschiedlich Unternehmen Branche eignen
Sonstiges;darueber hinaus arbeiten international Entwicklerteam unterstuetzen weltweit Softwareteam intern extern Mitarbeiter
Sonstiges;darueber hinaus besitzen knowhow Ablaeufe Tools Softwareentwicklung z b Application life cycle Management jenkins Azure devops services git
Sonstiges;darueber hinaus bieten Unternehmen verschieden Dienstleistung Bereich outsourcing Beratung Wartung Support
Sonstiges;darueber hinaus erstellen zugehoerig Softwaredokumentation
Sonstiges;darueber hinaus Verantwortung Fuer Betrieb Optimierung Absicherung strategisch Weiterentwicklung web Az
Sonstiges;darueber hinaus handeln sap Abstand wertvoll boersennotiert deutsch Unternehmen
Sonstiges;darueber hinaus uebernehmen Ausarbeitung Testing Software
Sonstiges;darueber hinaus wirken Konzeption Umsetzung Softwarearchitektur uebernehmen Anbindung Datenbank Erstellung Berechnungsregel Fuer Kpis insbesondere oee
Sonstiges;Segment Itservice beinhalten it Strategie Managementberatung individuell Softwareentwicklungsprojekt
Sonstiges;Debugging Fehlerbeseitigung Software bestehend System
Sonstiges;Definierung Hardwareanforderung Fuer bestehend Softwareloesung Bereich Embedded Systems
Sonstiges;abgeschlossen Studium Informatik Wirtschaftsinformatik anderer Mintfach neugierig Softwareentwicklung
Sonstiges;könnsten umfangreich Ecommerceskill erwerben echt Amazonprofi
Sonstiges;Arbeit dokumentieren selbststaendig legst wert Softwarearchitektur
Sonstiges;Rolle gemeinsam Verfuegbarkeit qualitaet Software sicher stellen
Sonstiges;soft skills analytisch Denkvermoeg Anpassung Teamfaehigkeit sicher auftreten loesungsorientiert handeln fuer selbstverstaendlich
Sonstiges;umfassend kenntnis Java kubernet Openshift agil softwareentwicklungsprojekten erwerben Erfahrung Test driv Development sammeln
Sonstiges;Schwerpunkt Unternehmenstaetigkeit liegen Bereich mobil Sicherheit Vermoegensberatung
Sonstiges;arbeiten Softwareprojekt Bezug Funktional Sicherheit
Sonstiges;fuer Erstellung Projekt Produktsoftwar zustaendig
Sonstiges;suchen Herzblut Spass Softwareentwicklung fuer spannend Aufgabe motiviert Team erfahren jung Mitarbeiter
Sonstiges;Design Entwicklung objektorientiert performant Software Zusammenarbeit erfahren Team
Sonstiges;Design Konzeption neu System Analyse Erweiterung vorhanden System Umfeld Devops Cloud
Sonstiges;Designs and recommends online Sales Programs and defin Shortmidlongterm Online Sales Strategies together with The Ecommerce Channel Partner and internal sales force and Stakeholders
Sonstiges;erwarten agil Softwareentwicklung kollegial Betriebsklima grundsympathisch Team
Softwareentwicklung für Cloud-Lösungen;anschliessend Administration Weiterentwicklung Azure basieren Cloudsystemlandschaft gehoert Kernaufgabe
Sonstiges;Anwendung Bereich Produktmanagement Zusammenarbeit Entwicklungseinheit weiterentwickeln
Sonstiges;eigenmark Edited stationaer Handel anbieten
Sonstiges;Einfuehrung System grundsaetzlich direkt Kunde Berater erfolgen
Sonstiges;Entwicklung neu Funktion Komponente backend applikationssoftwar Fuer Elektronenmikroskope
Sonstiges;Entwicklung Software Arbeit elektronisch Hardware Fuer elektrohydraulisch System
Sonstiges;erstellt Software Betrieb ueberfuehren Akzeptanztests durchfuehren Support Gewaehrleist
Sonstiges;Konzeption Spezifikation Design Ansteuerung komplex mikroskopkomponenten eng Kooperation Software Firmwareentwicklungsteam extern Partner
Sonstiges;notwendig Hardwareressource Demandware Verfuegung stellen sodass Kunde lediglich Weiterentwicklung Anpassung Shop beschaeftigen mussen
Sonstiges;Produkt Dienstleistung Salesforce mandantenfaehig
Sonstiges;Produkt Salesforce Unternehmen helfen Mitarbeiter Kunde Produkt vernetzen
Sonstiges;Softwareentwicklung open Source Technologien zb Eclipse Llvm zaehlen Aufgabe
Sonstiges;Standort bestehen zunaechst fort oblag Weiterentwicklung Betreuung Team
Sonstiges;Taetigkeit umfassen Phase Software Engineering Anforderungsanalyse ueber Implementierung Testmanagement Ziel effizient Performant modern Softwareloesung Steuerberatung aufbauen
Sonstiges;Unternehmensgruppe bestehen segment Kreditplattform Privatkund Immobilienplattform Versicherungsplattform
Sonstiges;zahlreich Analysewerkzeug ergaenzt services drittanbietern
Sonstiges;Dokumentation verantwortend Softwarekomponent
Sonstiges;Koenn sapanwend Problemmeldunge Sap schicken weiterverfolgen Dokumentation installationsmedien programmkorrektur vertikal Loesungen Schulung beziehen
Sonstiges;Administrierst verfolgen Ediservice sowohl Cloud intern Rechenzentrum
Sonstiges;arbeitestn agil Scrumteam entwickelst Loesungen Dokumentation Bereich
Sonstiges;begleitest anstehend Software Releases Testplanung Vorbereitung ueber Testdurchfuehrung Reporting Abnahme Releas
Sonstiges;begleitest eigenverantwortlich gemeinschaftlich Softwareentwicklung agierst Schnittstelle Kunde
Sonstiges;Behaeltst Ueberblick Bueroorganisation stellen reibungslos Tagesablauf sicher proaktiv Email Kalender Reisemanagement betreibst
Sonstiges;bekommsen umfassend Einarbeitung entwickelen neu bestehend Softwareloesung Bereich Automotive Logistik
Sonstiges;beraetst unterstuetzen Kunde Nutzung Software
Sonstiges;besitzen Faehigkeit analytisch denken komplex zusammenhaenge erkennen neu ansaetze loesungen initiieren
Sonstiges;fuer selbstaendig Analyse Anforderung Implementierung Funktion klassisch agil Softwareentwicklungsmethode verantwortlich
Sonstiges;operativ beratend leitend Gree itprojekten Fuer Rechenzentren Cloud Computing Thema unterwegs
Sonstiges;verantwortlich Fuer Konzeption Entwicklung Softwareanwendung anderer c net
Sonstiges;zustaendig Fuer Architekturerstellung Dokumentation Software
Sonstiges;bringstn Konzeption Entwurf qualifiziert Dokumentation Itloesung
Softwareentwicklung für Cloud-Lösungen;bringstn einschlaegig Berufserfahrung Entwicklung Implementierung sharepointloesungen
Sonstiges;bringstn Erfahrung Entwicklung Architektur Design Front Backendsoftware
Softwareentwicklung für Cloud-Lösungen;bringstn Erfahrung Cloudtechnologi Kafka Api
Sonstiges;definiersen Integrationsstrategie plansen Integrationsschritte Fuer softwarereleases
Sonstiges;denken Softwareentwicklung ganzheitlich Architektur implementierung Test Dokumentation fuer integral Bestandteil Arbeit
Sonstiges;Designst entwickelen implementierst Softwarekomponent fuer Neuentwicklung Krankenkassensystem
Softwareentwicklung für Cloud-Lösungen;entwickelen Konzept Messung Energieverbrauch Energieeffizienz Rechenzentren Cloud
Sonstiges;entwickelstn leidenschaftlich gerne Software verliersen zugrunde liegend geschaeftsprozesse Auge
Sonstiges;entwickelstn Schnittstell Kernsysteme individuell Anwendung Bereich Edi Electronic Data interchange
Sonstiges;entwickelen optimierst innovativ individualsoftwareloesungen Kundenanforderung Interdisziplinaer arbeitend Team
Sonstiges;entwickelen Verfahren Verbesserung bildqualitaet Messergebnisse Einmessung Geraete Bindest Produktsoftware
Sonstiges;erarbeitest Testalgorithme Durchfuehrung Softwaretest
Sonstiges;Erhaeltst intensiv Einblick strategisch Projekt Bereich business Development Ecommerce Arbeitest aktiv kanalspezifisch Produktvermarktung
Sonstiges;erlebst Entwicklung komplex Software requirements Jira Ueber Automatisierung Softwaretest Robot Framework Testmanagement Tools Testbench Enterprise
Sonstiges;ermoeglichst einfach Ansteuerung Hardwarekomponent intuitiv bedienenden Software
Sonstiges;findest Loesunge Stoerunge Livebetrieb stellen sicher Kunde ausfaellen betreffen
Softwareentwicklung für Cloud-Lösungen;Haeltst ueber Branchentrends neu Technologie Zusammenhang Sharepoint cloudbasiert Loesunge selbstaendig laufend
Sonstiges;Verstaendnis itinfrastrukturen Cloudplattform Virtualisierungstechnologi Containerisierung Anwendungsarchitektur
Sonstiges;Erfahrung Koordination Durchfuehrung Weiterentwicklung softwaretestung Istqbzertifizierung Vorteil
Sonstiges;Erfahrung objektorientiert Software Entwicklung beherrschen mehrere gaengig Programmiersprach Java python Typescript c etc
Sonstiges;Erfahrung Bereich Software Defined Network zb neutronovn Calico
Sonstiges;praktisch Erfahrung Programmierung datenbanksprach z b sql Datenbankoberflaech
Softwareentwicklung für Cloud-Lösungen;praktisch Erfahrung Cloud softwareentwicklung
Sonstiges;Spass Interesse technisch Innovation ecommercethemen betriebswirtschaftlich Zusammenhaeng
Sonstiges;hilfstn intern Team Kunde technisch Bewertung einzusetzend Technologien Iaas Paas Saas Azure kubernet Service Devtest Labs etc
Sonstiges;bewegen gesamt Spektrum Softwareentwicklung involvieren 
Sonstiges;kennen Cloud architecture frameworks Bzw betrachtesen mehrere ebenen Loesungsfindung
Sonstiges;Konzipierst Eigenstaendig Cloud architekturen Umsetzung data Lake Data Analytics Projekt
Sonstiges;kreiersen Entwicklerteam neu App
Sonstiges;Kuemmerst Administration Betrieb Mentzdienste aws Cloud
Sonstiges;Kuemmerst Pflege Datenbanken erstellst Dokumentation Fuehrst fehleranalysen unterstuetzen Fachbereiche Reports Auswertung Qlik sense
Sonstiges;lernst zusammenfuegen einzeln Komponent komplex Anwendung Continuous Integration besonderer Fokus Steigerung Softwarequalitaet
Sonstiges;optimierstn bestehend Module Prozess Bestandscode Erpsystem Swingpp Uebernimmst Wartung Anwendung Schnittstell
Sonstiges;plansen entwickelst Softwareloesung Kommissionierautomat Fuer Materialflusssteuerung Kommunikation Erpsystemen Interaktion Anwender
Sonstiges;plansen verwaltest Sharepointmigrationsprojekt cloudbasiert Sharepointumgebung
Sonstiges;schauen ueber Tellerrand Entwickler hinaus gestaltest gerne aktiv
Sonstiges;setzen anspruchsvoll Erweiterung bestehend Software
Sonstiges;setzen komplex Anforderung Software innerhalb agil Team
Sonstiges;studierst aktuell Onlinemarketing Ecommerce betriebswirtschaftslehr geisteswissenschaft Medienwissenschaft aehnlich Studiengang
Sonstiges;tauchen tief spannend Welt Ecommerce erhaeltst einblicke Shopmanagement Emailmarketing anderer Bereich
Sonstiges;treibst Softwarearchitekturentscheidung Idee Implementierung Integration Zielhardware voran
Sonstiges;Uebernimmst Entwicklung Firmware bootloadern Plattformsoftwar
Sonstiges;Uebernimmst praktisch Umsetzung Erweiterung Anpassungsauftraeg verschieden Anwendung Softwareentwicklung Arbeitest Projekt
Sonstiges;Uebernimmst Verantwortung neu Weiterentwicklung Software Fuer mobil Bereich
Sonstiges;Uebernimmst Verantwortung Fuer prozeß Qualitaetssicherung fuer Testing Abnahme Software
Sonstiges;Uebernimmst Verantwortung Fuer softwaretechnisch Umsetzung bzgl Lesbarkeit Wartbarkeit Erweiterbarkeit Testbarkeit Loesungen
Sonstiges;uebersetzen Konzeptionell physisch Datenmodelle Basis modern Microsoft Azure Cloud Architektur
Sonstiges;unterstuetzen administrativ Ecommerce key Account Manager
Sonstiges;unterstuetzen Entwicklung Ecom Artikel Idee Auslieferung Pos
Sonstiges;unterstuetzen strategisch Weiterentwicklung Umsetzung Aktivitaet Bereich Ecommerce key Account Management
Sonstiges;unterstuetzen Aufbau devopsloesunge
Sonstiges;unterstuetzen Konzeption Datenmodellierung Implementierung Qualitaetssicherung Data Warehouse Loesunge
Sonstiges;unterstuetzen Devopsansatz gesamt entwicklungsprozess Requirement Engineering ueber designen entwickeln testen Software Einsatzvorbereitung Durchfuehrung o Erfahrung
Sonstiges;unterstuetzen Projekt Implementierung neu services Basis Iaas Paas
Sonstiges;verfuegst mehrjaehrig Berufserfahrung Ecommerce prozess Projektmanagement
Softwareentwicklung für Cloud-Lösungen;verfuegst ueber fundiert Applikationserfahrung aufsetzen weiterentwickeln betreiben Software Cloud
Softwareentwicklung für Cloud-Lösungen;verfuegst ueber tief Itwisse Software entwickeln kennen entsprechend modern Ittechnologien zb Cloud Docker kubernet
Sonstiges;Waerst Multidisziplinaer agil Entwicklerteam Umfeld digital Transformation
Sonstiges;Crossfunktionalen Produktentwicklung Mechanik Elektronik firmware anwendersoftwar clouddien Kenntnisse Umgang Werkzeug
Sonstiges;zeigst Leidenschaft Fuer Softwareentwicklung fuer Codequalitaet
Sonstiges;langjaehrig Erfahrung Softwareentwicklung insbesondere Softwarearchitektur Webtechnologien zuhause bringstn tief technisch Verstaendnis Java Technologiestack
Sonstiges;Berufserfahrung Erfahrung aktuell frameworks Softwareentwicklungsmethod sammeln verfuegen ueber fundiert Programmierkenntnisse C Apiwebentwicklung
Sonstiges;durchfuehren Programmsoftwaretest Zusammenarbeit anderer fachbereichen dienstleistern
Sonstiges;Durchfuehrung Auswertung Softwaretest
Sonstiges;Durchfuehrung Betreuung Stufe Softwareentwicklung Konzepterstellung Anfertigung Dokumentation Programmierung Spaeter Funktionsvalidierung Verifizierung
Sonstiges;Durchfuehrung Evaluation Test Steigerung Ecommerce Performance
Sonstiges;Durchfuehrung maschinenoptimierung Taktzeitoptimierunge Fehlersuch
Sonstiges;berichten Handelsblatt vieler Bank Rueckzug sap Finanzindustrie zufrieden namentlich Spinoff Sap Fioneer ablehnen
Sonstiges;liegen Softwareentwicklung Themenumfeld statisch Code analyse C Sprache Hand
Sonstiges;eigenstaendig neu Weiterentwicklung Vertriebssteuerung Tourenplanung Net core Microsoftazuretechnologie
Sonstiges;eigenverantwortlich Leitung Softwareprojekt
Sonstiges;agil Itumfeld motiviert Entwicklerteam
Sonstiges;transparent Onboardingprozess Softwareteam professionell Herausforderung vorbereiten
Sonstiges;intensiv Einarbeitung fortwaehrend Weiterbildung Bereich Javasoftwareentwicklung
Sonstiges;loesungsorientierte arbeitsweisen Selbstorganisation fuer termingerecht Fertigstellung Aufgabe
Sonstiges;tief praktisch Erfahrung Rechenzentrum Hosting Cloudcomputing
Softwareentwicklung im E-Commerce;einschlaegig Erfahrung Ecommerce z b Data Analyst
Sonstiges;einschlaegig Methode Software Engineering Design patterns Test driv Development kennen nutzen
Sonstiges;entdecken Facette Software Engineering Planung Betrieb Konzept Implementierung testen Kundenkontakt
Sonstiges;entwerfen programmieren neu Softwaremodule Erweiterung maschinenfunktionalitaet eng Abstimmung Produktmanagement
Sonstiges;entwerfen zukuenftig Software einschliesslich Architektur Design
Sonstiges;entwickeln designen entwickeln testen neu softwareanwendung Funktion
Sonstiges;Entwicklung Betreuung Etlprozesse Datenbeschaffung Fuer Softwarewerkzeug Vermarktung Projektierung Seweurodriveprodukt
Sonstiges;Entwicklung Definition kurzmittellangfristig Onlinevertriebsstrategien Ecommercevertriebspartner Vertriebsmitarbeiter anderer Interessensvertreter
Sonstiges;Entwicklung Integration Softwareprojekt Fuer industrieanlag Erfassung Verwaltung Handling daten Spsmaschinensteuerung
Softwareentwicklung im E-Commerce;Entwicklung Konzeption modern softwareloesung web app desktopanwendungen
Sonstiges;Entwicklung Weiterentwicklung Softwarekomponent agil Team
Sonstiges;Entwicklung Applikationssoftware c c python
Sonstiges;Entwicklung Software Systemloesung Leitwartenarchitekture
Sonstiges;Entwicklung Softwarekomponent Demodulation Decodierung Funksignal unterschiedlich anwendungsbereich
Sonstiges;Entwicklung wiederverwendbaren softwaremodulen Fuer Einsatz unterschiedlich Produkt Betriebssysteme Microsoft ® windows ® Linux
Softwareentwicklung im E-Commerce;Entwicklung webbasiert Bedienoberflaech html Javascript
Sonstiges;Entwicklung implementierung Optimierung Marketing Automation entlang Customer Journey emailkontaktstrecken
Sonstiges;Entwicklung implementierung Durchfuehrung Dokumentation Softwaretest Zusammenarbeit Team
Sonstiges;Entwicklung Weiterentwicklung Pflege Softwaretools
Sonstiges;entwicklungsmoeglichkeiten Topsoftwareunternehmen zielorientiert Kultur flach Hierarchie
Sonstiges;Entwurf tragfaehig Softwarearchitektur Module fuer embeddedsystem
Sonstiges;Erarbeitung innovativ kundenorientiert Loesungen Austausch Mwd direkt Kundenkontakt
Sonstiges;Erarbeitung Bereitstellung Kpis Trend Kontext digital Strategie markt Wirksamkeit marketingkampagn Wirksamkeit Ecommerce Conversionanalyse Customer Journey Analyse Kundensegmentierung Grundlage Verhalten Website
Sonstiges;Erfahrung Bereich Controlling Ecommerce 
Sonstiges;Erfahrung Kundendienst idealerweise Ecommerce
Sonstiges;Erfahrung agil Entwicklungsmethodik Softwaretesting Dokumentation
Sonstiges;Erfahrung Entwicklung Umsetzung Softwarefunktion fuer elektrisch Antrieb
Sonstiges;Erfahrung Programmierung Spssteuerung kenntnisse Wincc Spssoftwaretools industriell Feldbussystem
Sonstiges;Erfahrung aktuell frameworks Softwareentwicklung bringen entsprechend kenntnisse Softwareentwicklungsmethode Programmierkenntnisse C Apiwebentwicklung
Sonstiges;Erfahrung Embedded Linux Treiber agil Softwareentwicklung scrumbasieren
Sonstiges;Erfahrung Microsoft Server Produkten Hybrid cloud infrastructure
Sonstiges;Erfahrung Knowhow Erfahrung agil Softwareentwicklung Verstaendnis Embedded Software fundiert Linux Programmiererfahrung Erfahrung Continuou Integration continuous Testing Erfahrung Architek
Sonstiges;Erfahrung Knowhow mehrjaehrig Berufserfahrung Bereich Embedded Software Elektronik fundiert fachkenntniss Erfahrung Entwicklung modular Softwarestruktur
Sonstiges;Erfahrung Bereich Softwareentwicklungengineering Vorteil
Sonstiges;Erfahrung Umgang Email marketingloesung Vorteil
Sonstiges;Erfahrung Umgang gaengigen Tools Jira Gitlab Jenkins Fuer Softwareentwicklung wuenschensweren
Sonstiges;Erfahrung professionell Softwareentwicklung Python fundiert Wissen ueber sql relational Datenbank
Softwareentwicklung für Cloud-Lösungen;Erfahrung modern Container Cloudarchitektur idealerweise kubernet
Sonstiges;erfolgreich abgeschlossen Ausbildung Studium Bereich Informatiksoftwareentwicklung
Sonstiges;erfolgreich abgeschlossen Hochschulstudium Techniker Fachrichtu
Sonstiges;erfolgreich abgeschlossen Studium Wirtschaftsinformatik Bzw Informationstechnik entsprechend Berufserfahrung Bereich Softwareentwicklung
Sonstiges;erfolgreich abgeschlossen Studium Informatik erfolgreich abgeschlossen technisch Ausbildung Weiterbildung Softwareentwicklung vergleichbar Qualifikation
Sonstiges;ermoeglichen regelbasiert betriebswirtschaftlich Katalog business Adaptation Catalog Entscheidung Konfigurationstabell System durchgereicht
Sonstiges;Berufserfahrung Softwareentwicklung praktisch Erfahrung Webentwicklung gerne Berufseinsteiger Erfahrung relevant Werksstudententaetigkeit Praktikum
