Wir bieten Einstiegspositionen für Menschen wie dich, die Spaß daran haben mit Cloud-Technologien zu hantieren und die Automatisierung voranzutreiben.;1;0;0;0
Du konntest bereits erste Projekte mit Tools wie Visual-Studio, Git und Jira umsetzen;1;0;0;0
Du konzipierst und realisierst die Projekte bis hin zum Rollout.;1;0;0;0
Du kümmerst dich um Konzepte sowie die Umsetzung neuer Anforderungen;1;0;0;0
Wir sind Experten im E-Commerce und entwickeln B2B-Onlineshops und Konfiguratoren.;1;0;0;0
Du möchtest bei einer bekannten Marke eCommerce und digitale Geschäftsmodell für den Endverbraucher aktiv mitgestalten? ;1;0;0;0
Du möchtest den gesamten Software-Entwicklungsprozess verstehen und geschäftskritische Individualsoftware auf höchstem Niveau gestalten?;1;0;0;0
Du möchtest den gesamten Software-Entwicklungsprozess verstehen und geschäftskritische Individualsoftware auf höchstem Niveau gestalten? Du sucht eine Zukunft im Software Engineering in einem global agierenden Unternehmen? ;1;0;0;0
Dann bist du als Cloud Network Engineer (m/w/d) bei STACKIT genau richtig. Wir sind ein junges Corporate Startup für digitale Services - von Colocation bis in die Cloud.;1;0;0;0
Du möchtest nach deinem (Fach-) Abitur zum 01.09.2023 oder ab sofort mit einer 3-jährigen Ausbildung (verkürzte Ausbildung möglich) im E-Commerce die ersten Schritte in dein Berufsleben starten.;1;0;0;0
Du setzt gerne Kundenwünsche um und bist bereit Dich in neue Technologien zu vertiefen;1;0;0;0
Du suchst eine neue berufliche Herausforderung in einer innovativen Unternehmensgruppe.;1;0;0;0
Du wirkst in herausfordernden und revolutionären IT-Projekte;1;0;0;0
Du wirst sowohl die Möglichkeit haben dir ein breites Wissen in vielen verschiedenen Bereichen anzueignen oder dich zu spezialisieren und zum Experten in einem Gebiet zu werden.;1;0;0;0
Du wirst Teil unserer cross-funktionalen Produktentwicklung (Mechanik, Elektronik, Firmware, Anwendersoftware, Cloud-Dienste).;1;0;0;0
Du zeichnest dich durch eine analytische Vorgehensweise, Freude und Ausdauer bei der Konzeption kreativer Problemlösungen aus;1;0;0;0
Durch die langjährige Erfahrung und das umfassende Know-How unseres Entwicklungsteams sorgen wir immer für eine erfolgreiche und passende Lösung.;1;0;0;0
Durch Praktika o.ä. hast du bereits Erfahrung im Bereich Marketing oder speziell in den Bereichen Business Development oder E-Commerce gesammelt ;1;0;0;0
Dvs – Datenverarbeitungsgesellschaft Sparkassenorganisation mbHDie Datenverarbeitungsgesellschaft Sparkassenorganisation mbH (dvs) versorgte alle ostdeutschen Sparkassen mit Datendienstleistungen;1;0;0;0
egelmäßige Berichterstattung des Projektfortschritts an den Vorgesetzten;1;0;0;0
Eigenverantwortlich betreuen Sie alle Phasen innerhalb der SPS-Softwareentwicklung für komplexe Sondermaschinen im Montage-, Test- und Prüfumfeld inkl. Leittechnik-Anbindungen. ;1;0;0;0
Eigenverantwortlich übernimmst du die Projektkoordination;1;0;0;0
Eigenverantwortlicher Handlungsbereich und selbstständiger Arbeitsplanung;1;0;0;0
Ein hohes Maß an Flexibilität und die Möglichkeit im Home-Office zu arbeite;1;0;0;0
Ein Kern der dafür benötigen Simulationen bildet die Erzeugung von virtuellen Steuergeräten (V-ECUs), bei denen der produktive Seriencode für die Ausführung in unserer Software-in-the-Loop-Umgebung integriert wird. ;1;0;0;0
Ein weiterer Technologie-Standort wurde im Spätsommer 2015 in Helsinki, Finnland eröffnet;1;0;0;0
Einblicke in die Bereiche E-Commerce, Online-Marketing, Customer Success sowie Vertrieb und Finance helfen Dir dabei zu verstehen, was eine professionelle Online-Vertriebsplattform ausmacht und welche Prozesse sich hinter dem Online-Vertrieb verbergen.;1;0;0;0
Eine Vielzahl von Faktoren wie Energieeffizienz, immer komplexer werdende Assistenzsysteme, E-Mobilität und automatisiertes Fahren erfordern eine stärkere Vernetzung der verschiedenen Fahrfunktionen, was wiederum die Anforderungen an die Entwicklungs- und Absicherungstoolkette stetig erhöht. Als Teil des Teams übernehmen Sie Verantwortung für die Umsetzung der Produktanforderungen in Form von hochwertigen Softwarelösungen. ;1;0;0;0
Einführung und Erweiterung von E-Commerce-Reportings. ;1;0;0;0
Einsatz verschiedener Frameworks und Technologien zur Entwicklung und Integration der notwendigen Software-Komponenten, u. a. TypeScript/JavaScript, Spring Boot, REST (Open API) ;1;0;0;0
Engineering people ist eine Vision, bei der Menschen, Ideen und Technik zusammenkommen.;1;0;0;0
Entdecke alle Facetten des Software Engineerings von der Planung bis zum Betrieb: Konzepte, Implementierung, Testen und Kundenkontakt;1;0;0;0
Entwickeln und pflegen der etablierten Software Anwendungen zur Maschinensteuerung auf Windows Betriebssystemen ;1;0;0;0
Entwicklung mit GO in einem agilen Projekt;1;0;0;0
Entwicklung von echtzeitfähigen Software-Lösungen mit TwinCAT 3;1;0;0;0
Im Zuge dessen entwickelst du Desktop- und Webapplikationen und Software-Architekturen.;1;0;0;0
Entwicklung von hardwarenaher Software für unsere AURIX Plattform (Low Level Treiber iLLD, AURIX 2nd Gen.) unter Berücksichtigung der funktionalen Sicherheit;1;0;0;0
Entwicklung von Konzepten;1;0;0;0
Entwicklung von maßgeschneiderten Softwarelösungen ;1;0;0;0
Entwicklung von Steuerungslösungen im Bereich Bewegungssteuerung, Bahnplanung und verteilte Systeme ;1;0;0;0
Erarbeitung von Projektplänen mit der Verantwortung für Aufwandskalkulation und Einhaltung von Zeit- und Budgetplänen;1;0;0;0
Erfahrene/n Softwareentwickler / Programmierer für die Verkehrswende (m/w/d) ;1;0;0;0
Erfahrung im Onlineshop Management bzw. im Bereich E-Commerce, idealerweise im B2B-Umfeld, sowie Praxis im Projektmanagement und in der Koordination von Dienstleistern sind wünschenswe;1;0;0;0
Erfahrungen in agiler Softwareentwicklung, einschlägige Berufserfahrung, idealerweise Erfahrung im Betrieb komplexer IT Systeme, Linux, Containerisierung, Software-Paketmanagement (Debian, snap), Systemadministration, Compiler, Kenntnisse in Linux, Grundlagen in Netzwerk-Technologien, Softwareentwicklungsprozesse und -Umgebungen, Kenntnisse / Verständnis von Linux-Lösungen/QNX, ROS2, AI-Toolchains sind von Vorteil,;1;0;0;0
"Erfahrungen und Know-how: Sie besitzen Expertise in der Softwareentwicklung, vorzugsweise im Sondermaschinenbau und Sie bringen Wissen in der Programmierung, vorzugsweise mit SPS nach IEC61131 (z. B. TwinCAT) oder Siemens Step 7 und Echtzeit-Betriebssystemen bzw. Windows, mit; Zusätzliches Know-how in Hochsprachen sind von Vorteil";1;0;0;0
Erstellung der zugehörigen Dokumentation und Arbeitsanweisungen für die Fertigung;1;0;0;0
Erstellung von Dokumentationen für den Know-how-Transfer und Support von Endanwendern;1;0;0;0
Es wurde am 3 September 1995 von Pierre Omidyar in San José (Kalifornien) unter dem Namen AuctionWeb gegründet;1;0;0;0
Etteplan ist ein schnell wachsendes Technologie-Dienstleistungsunternehmen, das sich auf Lösungen in den Bereichen Software und Embedded, Engineering und technische Kommunikation spezialisiert hat. ;1;0;0;0
Evident liefert innovative Lösungen, die einen Beitrag für eine sicherere und gesündere Welt leisten. Dabei setzen wir uns zum Ziel, die Erwartungen unserer Kunden zu übertreffen, indem wir Lösungen sowie erstklassige Kundenservices anbieten, die auf die Bedürfnisse unserer Kunden optimiert sind.;1;0;0;0
Finnova nimmt eine wichtige Stellung in der Schweiz ein und gehört zu den rund 20 Netzwerkpartnern der Kantonalbanken;1;0;0;0
Flache Hierarchien, schnelle Entscheidungswege und viel Gestaltungsraum;1;0;0;0
Fokussiert auf den Versicherungsbereich bieten wir IT-Lösungen und -Beratungsleistungen rund um die Digitalisierung der Versicherungsbranche an. bei einem der führenden Anbieter für IT-Lösungen und Consulting in der Versicherungsbranche ;1;0;0;0
Für den Bereich E-Business suchen wir – am Entwicklungsstandort Schorndorf bei Stuttgart inkl. Mobile Working – zum nächstmöglichen Zeitpunkt dich, alsJavaScript-Software Entwickler im Bereich E-Commerce (m/w/d).;1;0;0;0
Für den Lesermarkt suchen wir zum nächstmöglichen Termin einen im E-Commerce (m/w/d) in Vollzeit. ;1;0;0;0
Für die Verstärkung unseres Teams suchen wir für unseren Hauptsitz in Freiburg einen Cloud Entwickler in (d/w/m) Wir geben Spammern keine Chance: Mit unseren Software-Lösungen haben Unternehmen die Möglichkeit professionelles E-Mail-Marketing zu betreiben – teils völlig automatisiert, aber immer rechtssicher. ;1;0;0;0
Für die Zufriedenheit unserer Kunden liefern wir digitale und vernetzte Lösungen höchster Qualität zum vereinbarten Zeitpunkt. ;1;0;0;0
Unser Schwerpunkt sind Softwareentwicklungsprojekte im Bereich der Homologation und Datenmanagement.;1;0;0;0
Für dieses Projekt werden wir mit Fördergeldern von der Landesregierung im Rahmen eines Forschungsprojekts unterstützt.;1;0;0;0
Für ein attraktives und wachsendes IT-Dienstleistungsunternehmen suchen wir in einer Führungsaufgabe einen Großprojekt-Leiter / Programm-Manager ;1;0;0;0
Für meinen Kunden, einem dynamischen und internationalen Einzelhandelsunternehmen, welches weltweit über 25.000 Mitarbeiter in 50 Ländern beschäftigt, davon;1;0;0;0
Für unsere Abteilung Marketing in unserer Zentrale in Bremen suchen wir einen Senior Product Owner (m/w/d) E-Commerce. ;1;0;0;0
Für unseren Standort in Pfaffenhofen a. d. Roth (Ulm) suchen wir zum nächstmöglichen Zeitpunkt Software-Entwickler (m/w/d) mit dem Schwerpunkt Software-Test. ;1;0;0;0
Für unseren Standort in Tübingen suchen wir für unseren Bereich Entwicklung einen Software-Entwickler Schwerpunkt Software-Test (m/w/d) ;1;0;0;0
Gemeinsam für eine digitalisierte, zukunftsfähige und lebenswerte Welt.;1;0;0;0
Gemeinsam im Team entwickelst du Konzepte und setzt neue Anforderungen um Die Anforderungen;1;0;0;0
Gemeinsam im Team, aber auch mit zentralen Entwicklerteams und externen Software Dienstleistern erarbeiten sie IT-Lösungen und entwickeln diese für den produktiven Einsatz in unserer internationalen Fertigung. ;1;0;0;0
Aufgabe dieses Teams ist es, die Cloud-Strategie von Daimler Trucks and Busses zu formen und weiterzuentwickeln, sowie unseren Kunden zukunftsfähige Cloud-Plattformen on- als auch off-premises zur Verfügung zu stellen.;1;0;0;0
Gestalte mit uns die Zukunft von e-health als Softwareentwickler Web-App (m/w/d) Für die nächste Stufe der e-health Evolution suchen wir kreative Köpfe, die Spaß an der Arbeit mit vielfältigen Technologien, eigenen Gestaltungsspielräumen und der beruflichen Weiterentwicklung haben.;1;0;0;0
Gestalten des Software-Engineering Prozesses, insbesondere mit dem Einsatz von modernen Frameworks und Technologien gehört zu Ihren Aufgaben ;1;0;0;0
Gestalten von cleveren und innovativen Lösungen als Teil eines agilen Teams;1;0;0;0
Gewährleistung der Übersichtlichkeit und Usability der Anwendungen.;1;0;0;0
Ggf. Interesse an der Rolle des Scrum Masters;1;0;0;0
GOM Metrology, ein Unternehmen der ZEISS Gruppe, ist spezialisiert auf industrielle 3D-Koordinatenmesstechnik, 3D-Computertomografie sowie 3D-Testing und unterstützt Kunden weltweit mit Maschinen und Anlagen zur manuellen und automatisierten 3D-Digitalisierung, Auswertesoftware, Training und professionellem Support aus einer Hand.;1;0;0;0
Hierbei analysieren Sie Anforderungen, entwickeln und verbessern Software und Schnittstellen, erstellen Testpläne sowie Dokumentationen und extrahieren / transformieren Datenstrukturen. ;1;0;0;0
Hierbei steht die Entwicklung der eigenen Anwendungssysteme sowie die Anpassung und Einbindung verschiedenster Standardsoftwareprodukte im Fokus. ;1;0;0;0
Hierzu konzipierst sowie implementierst Du Softwarelösungen in die Testinfrastruktur und sorgst für den Betrieb dieser. ;1;0;0;0
Dir obliegt die lösungsorientierte Erstellung neuer Use Cases für die Testumgebung. ;1;0;0;0
Dabei tragen wir die ganzheitliche Verantwortung für IT-Lösungen im VW Konzern und gestalten die kontinuierliche Erneuerung der Unternehmens-IT entlang der gesamten digitalen Wertschöpfungskette aktiv mit.;1;0;0;0
Hilfestellung für Kunden im Rahmen von Refinement-Workshops zur Definition von Anforderungen;1;0;0;0
Home Office möglich,Teilzeit,Vollzeit;1;0;0;0
Home Office möglich,Vollzeit - Rund 10.000 Beschäftigte in 12 europäischen Ländern arbeiten mit großer Begeisterung und viel Engagement für die Marke bofrost;1;0;0;0
IBM Bluemix ist eine von IBM entwickelte Cloud-Plattform als Service (PaaS);1;0;0;0
IBM ist eines der weltweit führenden Unternehmen insbesondere für branchenspezifische Produkte und Dienstleistungen im IT-Bereich sowie Software und Hardware;1;0;0;0
Idealer Weise verfügen Sie über mindestens 2 Jahre Berufserfahrung in der Softwareentwicklung, insbesondere in der Programmierung von Microcontrollern - aber auch Berufseinsteigern geben wir gerne die Möglichkeit zum Einstieg in dieses spannende Thema;1;0;0;0
Idealerweise 1-2 Jahre Berufserfahrung im Bereich E-Mail Marketing, Online Marketing oder E-Commerce;1;0;0;0
Idealerweise konntest du bereits einige Jahre Berufserfahrung als Entwickler (m/w/d) in einem DevOps Team mit Schwerpunkt Betrieb, in der technischen Betreuung von Software-Anwendungen oder als Application Manager (m/w/d) sammeln und hast Erfahrung mit CI/CD automatisierten Deployment Pipelines, Testing und entsprechenden Frameworks;1;0;0;0
Identifizieren von Automatisierungspotential von IT- bzw. software-gestützten Prozessen ;1;0;0;0
Im April 2015 eröffnete das Unternehmen einen zusätzlichen Technologie-Standort in Dublin (Irland);1;0;0;0
Im Bereich E-Commerce gehören sowohl das monatliche E-Commerce Tracking als auch die Optimierung und Pflege der Produktpräsenz bei unseren 3rd-Party Partnern zu klassischen Aufgaben;1;0;0;0
Im Dezember 2013 wurde das Unternehmen von einer Gesellschaft mit beschränkter Haftung (GmbH) in eine Aktiengesellschaft (AG) umgewandelt;1;0;0;0
Im Dezember 2022 berichtet das Handelsblatt das Business ByDesign die großen Erwartung nie erfüllt habe;1;0;0;0
Im Dezember 2022 berichtet das Handelsblatt, das die Mittelstandslösung Business ByDesign nicht mehr weiterentwickelt wird und die Wartung an einen externen Dienstleister geht;1;0;0;0
Im Juli 2012 wurde bekannt, dass das Unternehmen einen Teil der Software-Entwicklung am Standort in Dortmund bündelt;1;0;0;0
Im Juni 2018 wurde der vollständige Verkauf von Magento an Adobe Inc bekannt gegeben;1;0;0;0
Im Mai 2015 wurde das Unternehmen in eine Aktiengesellschaft umgewandelt;1;0;0;0
Im Markt für Unternehmenslösungen (Package Applications) ist Oracle mit Oracle Applications, E-Business Suite, Hyperion Performance Management, PeopleSoft Enterprise, JD Edwards EnterpriseOne, JD Edwards World und Siebel Systems vertreten;1;0;0;0
Im Oktober 2017 wurde Bluemix in IBM Cloud umbenannt;1;0;0;0
Im Oktober 2022 wurde bekannt, dass SAP die Branchenlösung SAP for Healthcare (früher auch als IS-H bezeichnet) mit Ablauf der Wartung für die SAP Business Suite (2027 bzw 2030) in der bisherigen Form nicht mehr anbieten wird;1;0;0;0
Im Rahmen deiner Ausbildung zur/m Kauffrau / Kaufmann im E-Commerce erwarten dich ;1;0;0;0
Im Rahmen der Digitalisierungsoffensive besitzen wir im Rahmen der Architektur die Aufgabe, die Vorgehensweisen, Prozesse und Technologien im Kontext;1;0;0;0
Im Rahmen Ihrer Tätigkeit als IT-Applikationsspezialist (m/w/d) für Kundenprojekte stellen Sie die Implementierung durchgängiger IT-Lösungen;1;0;0;0
Im Rahmen Ihres Praktikums im Online-Marketing erhalten Sie umfassende Kenntnisse in den Bereichen E-Commerce und digitaler Transformation bei einer international tätigen Premiummarke. ;1;0;0;0
Im Ranking der 500 größten Familienunternehmen in Deutschland der Zeitschrift Wirtschaftsblatt nahm die Gruppe 2012 den zehnten Platz ein;1;0;0;0
Im Team (weiter-)entwickeln – Wir setzen auf die Stärke der Teamarbeit und profitieren von internen Communitys.;1;0;0;0
Im Team der Steuerungstechnik stärken Sie den Exentis Standort für Plattform und Systeme in Malterdingen, mit der Entwicklung und Implementierung von industrieller Bildverarbeitung und steuerungsnaher Software für unsere Kunden- und Technologie-Projekte. ;1;0;0;0
Im Team überprüfen wir unsere Vorgehensweisen und gestalten unsere Prozesslandschaft ständig neu;1;0;0;0
Implementierung und Ergänzung von Schnittstellen zu anderen Systemen (z. B. zur übergeordneten SPS, zu externen Sensor-/Vision-Systemen oder zu Softwareprodukten der Unternehmensgruppe) ;1;0;0;0
in betrachtest du den Lösungsraum ganzheitlich aus verschiedenen Perspektiven – von der funktionalen Ebene als Schnittstelle in Richtung Business, über die nicht-funktionalen Anforderungen, bis zur Betriebsfähigkeit. ;1;0;0;0
In den letzten Jahren hat Amazon zahlreiche Webservices entwickelt, welche der Verwaltung des Kernangebots dienen;1;0;0;0
In der Administration von Cloud-Systemen ;1;0;0;0
In der von Statista veröffentlichten Rangliste der umsatzstärksten Onlinehändler im Segment Mode in Deutschland nahm About You 2020 gemeinsam mit Bonprix den fünften Platz ein;1;0;0;0
In einem agilen Entwicklungsteam sind Sie für die (Web-)Entwicklung von Software für die industrielle Automation verantwortlich ;1;0;0;0
In enger Zusammenarbeit mit unserem ca. 80-köpfigen Entwicklungsteam sind Sie für die Installationssoftware unserer Mikroskopieanwendungen verantwortlich;1;0;0;0
In flexiblen Teams, die mit Herz und Verstand Lösungen vorstellen, die sich noch kaum einer vorstellen kann. ;1;0;0;0
in für das Ressourcenmanagement bist du verantwortlich für die Gestaltung, Implementierung und Optimierung von Automatisierungslösungen unter Verwendung des Kapazitätsmanagement-Tools IBM Turbonomic, um Ressourcen optimal zu nutzen und Leistungsspitzen zu bewältigen. ;1;0;0;0
In Ihrem neuen Job als Softwareentwickler stellen Sie mit der Implementierung und Weiterentwicklung von Softwareprojekten unseres modularen Manufacturing Execution System (MES) die Transparenz, Flexibilität und Effizienz der gesamten Spritzgießproduktion unserer Kunden sicher. ;1;0;0;0
in in der Robotik sind Sie in unseren Anlagenprojekten zuständig für die Qualität, Liefertermine und Kosten der Softwareentwicklung sowie Applikation.;1;0;0;0
In über 140 Ländern stellen wir unseren Kunden Kfz-Ersatzteile, technische Informationen sowie Diagnostics Hard-/Software und Services zur Diagnose, Wartung und Reparatur von Kraftfahrzeugen zur Verfügung. Plochingen ist unser zentraler Standort für die Entwicklung, Fertigung und das Produktmarketing von Diagnostics Hard- und Software.;1;0;0;0
In unserem E-Commerce-Team setzen wir auf gute Zusammenarbeit und haben Lust, gemeinsam weiterzukommen. ;1;0;0;0
In unserem internationalen Team betreuen wir die Software unserer Bestandskunden, und helfen diesen, für die aktuellen Marktanforderungen gewappnet zu sein. ;1;0;0;0
in verantwortlich für die Entwicklung und Nutzung von Rest APIs sowie für die Frontend- und Backend-Entwicklung in Bezug auf das Kapazitätsmanagement-Tool. ;1;0;0;0
praktische Kenntnisse im Performance Marketing sind von Vorteil. ;1;0;0;0
Individuell abgestimmte Förderungsmaßnahmen zur ständigen Weiterentwicklung;1;0;0;0
Innovative Entwicklungsdienstleistungen, kreatives Produktdesign und moderne Softwarekonzepte ergänzen das Produktportfolio. ;1;0;0;0
Interessante Projekte überwiegend im Automotive Bereich;1;0;0;0
Kaufmann/-frau im E-Commerce (m/w/d) ;1;0;0;0
Du auf das Aufgabenfeld rund um den Online-Handel und die damit einhergehenden vertriebsorientierten Funktionen im Unternehmen fokussiert. ;1;0;0;0
Kaufmännische Ausbildung mit Schwerpunkt E-Commerce, Marketing oder relevante Berufserfahrungen;1;0;0;0
Kenntnisse über die Messung des Energieverbrauchs pro Prozess in einer Softwareanwendung in der Cloud und ein tiefes Verständnis aller Faktoren, die die Messungen beeinflussen. ;1;0;0;0
Kerngeschäft ist der Einzelhandel;1;0;0;0
Kollegen mit hohem Qualitätsanspruch an digitale Lösungen;1;0;0;0
Konzeption und agile Entwicklung von Softwaresystemen im Web- und IoT-Umfeld. ;1;0;0;0
Konzipierung und Modellierung von konzernweiten Integrations- und Lösungsarchitekturen unter Berücksichtigung von Migrationsszenarien ;1;0;0;0
Leidenschaft für technologischen Fortschritt ausleben?;1;0;0;0
Leitung und Steuerung von großen interdisziplinären Projektteams, unter Berücksichtigung klassischer, agiler und hybrider Werte und Methoden;1;0;0;0
Lust auf E-Commerce Deutschlandticket für 30 €, kostenfreie Parkplätze, e-Ladesäulen, Auto-Services, StadtRAD-Stationen;1;0;0;0
Machen Sie noch heute den entscheidenden Schritt Ihrer Karriere und bewerben Sie sich bei uns als Cloud / Software Architect.;1;0;0;0
Magento steht unter der Open Software License Version 3;1;0;0;0
Mai 2007 wurde beschlossen, dass die FinanzIT in Fusionsverhandlungen mit der Sparkassen Informatik eintritt;1;0;0;0
Management der E-Commerce-Vertriebspartner (Direkt & Distribution) zur Steigerung des Umsatzes und der Rentabilität für eine starke Markenpräsenz ;1;0;0;0
Management of all assigned e-Commerce channel partner (direct & distribution) to boost sales and profitability for a strong presence of our brand/portfolio on the market ;1;0;0;0
März 2023 wurde die msg GillardonBSM AG in msg for banking ag umbenannt;1;0;0;0
Media Solutions GmbH: Wir sind ein innovatives, mittelstndisches Unternehmen mit Sitz in Mnchen.;1;0;0;0
MEGABAD ist ein führendes E-Commerce-Unternehmen in der Sanitärbranche und bietet hochwertige Bad- und Sanitärprodukte sowie umfassende Lösungen für anspruchsvolle Kunden. Wir suchen einen MEGA Werkstudenten (m/w/d) Online Marketing/ E-Commerce ;1;0;0;0
Mehr als 8.500 Mitarbeitende geben alles, um die Digitalisierung der Geschäftsprozesse unserer über 500.000 Kund:innen voranzutreiben.;1;0;0;0
Microsoft Azure (kurz: Azure, Aussprache: [ˈæʒər]) (vormals: Windows Azure) ist eine Cloud-Computing-Plattform von Microsoft mit den Diensten wie SQL Azure oder AppFabric, die sich in erster Linie an Softwareentwickler richtet;1;0;0;0
mindestens 2-jährige Berufserfahrung in der Softwareentwicklung mit Typescript und Node.js (Microservices) sowie natürlich mit JS, HTML und CSS;1;0;0;0
Mit ber 25 Jahren Erfahrung in den Bereichen Beratung und Individualentwicklung stehen wir fr Lsungskompetenz, mageschneiderte IT-Lsungen und kundenorientierte Dienstleistungen.;1;0;0;0
Mit deinem Engagement im mechatronischen Team zur Entwicklung modularisierter und standardisierter Robotik-Lösungen leistest du einen wesentlichen Beitrag zu unserem Geschäftserfolg. ;1;0;0;0
Mit Hands-on-Mentalität können Sie neue Themen und Technologien einbringen und steuern.;1;0;0;0
Mit Know-how und Leidenschaft entwickeln rund 900 Mitarbeitende weltweit innovative Lösungen und Dienstleistungen.;1;0;0;0
Mit modernen technologischen Systemen werden intelligente Lösungen für die komplexen Aufgaben der grafischen Industrie entwickelt. ;1;0;0;0
Mit spannenden eigenen Aufgaben und ersten kleinen Projekten kannst Du als Werkstudent (gn;1;0;0;0
Mit unseren modernen und wissensbasierten Teams sind wir Technologiepartner namhafter Unternehmen aus dem Mobilitäts- sowie Industriesektor.;1;0;0;0
Mit unseren Software-Produkten zu Projekt- und Portfoliomanagement, Ressourcenplanung sowie Systemintegration gehören wir zu den weltweiten Marktführern in…;1;0;0;0
Mit unserer Multisource-Analytics-Software SCOPE hilft unsere 85-köpfige #innocrew unseren Kunden täglich dabei, die Welt ein Stück sicherer zu machen.;1;0;0;0
Du hast Spaß an einer abwechslungsreichen Tätigkeit und bringst eine Leidenschaft für den Bereich Softwareentwicklung mit?;1;0;0;0
Mit unserer Verbindungs-, Interface- und Automatisierungstechnik finden wir zukunftsweisende Lösungen für Gebäude und Industrie. ;1;0;0;0
Mitarbeit an Konzepten, Design und Architektur;1;0;0;0
Mitarbeit bei der Erstellung von Lastenheften;1;0;0;0
Mitarbeit in einem kompetenten, motivierten, internationalen und agilen Team;1;0;0;0
Mitarbeit in einem SCRUM-Team von Embedded Software Spezialisten Als Global Player sorgen wir bei SEW-EURODRIVE für Bewegung: mit wegweisenden Technologien und maßgeschneiderten Lösungen in der Antriebs- und Automatisierungstechnik. ;1;0;0;0
Mitarbeit in kleinen agilen Softwareentwicklungsteams (3 – 8 Personen);1;0;0;0
Möchten Sie die nächste Stufe in Ihrer Karriere erreichen?;1;0;0;0
Moderation von (Kunden-)Workshops;1;0;0;0
Möglichkeit des Mobilen Arbeitens;1;0;0;0
Nach Anzahl der Mitarbeiter der Banken hält Finnova mit 18 %, nach dem Wettbewerber Avaloq mit 42 %, den zweitgrössten Marktanteil;1;0;0;0
Nach Schätzungen beträgt die Anzahl der Beschäftigten in Deutschland 16;1;0;0;0
Neu- und Weiterentwicklung von Softwarelösungen für unsere Maschinen in C#/.NET ;1;0;0;0
Als Anbieter von laserbasierten Lösungen für viele Hochtechnologiebranchen sind wir mit 45 Jahren Erfahrung und rund 900 Mitarbeitern (m/w/d) weltweit eine feste Größe.;1;0;0;0
Nicht zuletzt überprüfen Sie die Leistungserbringung und Softwarequalität unserer externen Programmierer und unterstützen die Abnahmen. ;1;0;0;0
November 2015 gab das Private-Equity Unternehmen Permira die Übernahme von Magento Inc;1;0;0;0
NTT DATA gehört zu den weltweit führenden Dienstleistern für Business- und IT-Lösungen.;1;0;0;0
Online Marketing Manager, Kaufmann im E-Commerce o. ä. als E-Mail Marketing Manager (m/w/d) ;1;0;0;0
Oracle Corporation ist ein US-amerikanischer Soft- und Hardwarehersteller mit Hauptsitz in Austin, Texas;1;0;0;0
PKS Software GmbH - PKS ist ein innovatives Softwareunternehmen mit Hauptsitz in Ravensburg. ;1;0;0;0
Programmierung von Software zum Datenaustausch mit anderen Systemen (z.B. über CAN und CAN J1939, IO-Link, Bluetooth);1;0;0;0
