Softwareentwicklung im Bankensektor;entwickelen vorhanden Software Zebcontrol Fuer finanzbereich konsequent bringstn zeb persoenlich Karriere voran
Softwareentwicklung im Bankensektor;Entwicklung geschaeftskritisch kundenspezifisch Softwareloesung
Softwareentwicklung im Bankensektor;Fuer Commerzbank entwickeln Cpu Software Unterstuetzung baufinanzierungsgeschaeften
Softwareentwicklung im Bankensektor;gleichzeitig erfolgen Markteinfuehrung Avaloq Banking Systems
Softwareentwicklung im Bankensektor;Kerngeschaeft Unternehmensgruppe Itdienstleistung Fuer Volksbanke Raiffeisenbank fuer Unternehmen Zentralinstitution genossenschaftlich Finanzgruppe
Softwareentwicklung im Bankensektor;vieler Addon diverser Partner sap entwickeln standardfunktion erweitern Business one Branchenloesung
Softwareentwicklung im Bankensektor;Mitarbeit Definition Konzeption Realisierung neu Softwarekomponent Produktumfeld Finanzit
Softwareentwicklung im Bankensektor;uebernehmen Pruefung bauteil Software teststaend endprodukt erstellen komplex algorithmen fuer Software
Softwareentwicklung im Bankensektor;unterstuetzen Erstellung Softwareanforderung
Softwareentwicklung im Bankensektor;Software Loesungen entwickeln Kunde helfen Produktionsprozesse optimieren
Softwareentwicklung im Bankensektor;Unterstuetzung Problem Software Produktion
Softwareentwicklung im Bankensektor;arbeiten Basis Grundprinzipi agil Softwareentwicklung Erstelle Leidenschaft anspruchsvoll fachapplikation Fuer Finanzdienstleister
Softwareentwicklung im Bankensektor;zentral Aufgabe Unternehmen Entwicklung Bereitstellung bankenspezifisch Software entsprechend Beratungsdienstleistung
Softwareentwicklung im Bankensektor;Ziel finanziteigen Kernbanksystem anderer abzuloese
Softwareentwicklung im Bankensektor;Teamkolleg entwickeln pflegen softwareloesungen Basis fuer Handlings Prozessanlag bilden
Softwareentwicklung im Bankensektor;folgen Software Immobilienfinanzierung Fuer bayerisch Landesbank
Softwareentwicklung im Bankensektor;Finis gruenden Entwicklung modular Gesamtbankenloesung beginnen
Softwareentwicklung im Bankensektor;Startupunternehmen Sonect virtuell Geldautomat App Fuer smartphones Marketplace integrieren
Softwareentwicklung im Bankensektor;bekanntgeben Sixplattform Blink ueber Openfinanceapis Kernbankenloesung Finnovas integrieren
Softwareentwicklung im Bankensektor;Junior Java Consultant erstellen webanwendungen Itloesung Fuer Kunde Bankenumfeld
Softwareentwicklung im Bankensektor;bankensoftwareentwicklungsunternehmen konzentrieren folgend Bereich digital Bankdienstleistunge
Softwareentwicklung im Bankensektor;Fintech weltsparen Raisin Anfang Temenosmarketplace integrieren
Softwareentwicklung im Bankensektor;Finanz Software Entwicklungsunternehm bieten Scand Erstellung Loesunge Fuer persoenlich Finanzmanagement komplex Finanzberichtssystem
Softwareentwicklung im Bankensektor;Itdienstleister entwickelt implementieren pflegen izb Soft Itsystem Anwendung Auftrag bayerisch Sparkasse deutsch Kreditbank oesterreichisch Institut
Softwareentwicklung im Bankensektor;Softwareentwickler Java ee Beratungshaeuser Deutschland arbeiten Bereich speziell Software Fuer Bank fokussieren
Softwareentwicklung im Bankensektor;Bank Finanzanwendunge Entwicklungsteam entwickeln bieten leistungsstark Geschaeftsloesung einschliesslich komplex Geschaeftslogik benutzerfreundlich benutzeroberflaech fortschrittlich Sicherheitsniveau
Softwareentwicklung im Bankensektor;ppi modern Technologien Praxis anwend innovativ Bankenloesunge entwickeln Karriere great place to work ® durchstarten
Softwareentwicklung im Bankensektor;business one sap eingefuehren basieren Software Topmanage israelisch Hersteller Topmanage Financial solutions ltd
Softwareentwicklung im Bankensektor;erwarten Uebernimmst Entwicklung Banking prozessen backend Lernst programmiersprach clojure
Softwareentwicklung im Bankensektor;Kernbankensystem Temenos T
Softwareentwicklung im Bankensektor;Leistungs Produktportfolio umfassen entwickeln bereitstellen Finanzdienstleistungssoftware Beratung Betreuung Kunde
Softwareentwicklung im Bankensektor;Unternehmen zaehlen fuehrend Hersteller integriert gesamtbankloesung
Softwareentwicklung im Bankensektor;Usfintechunternehmen bieten Zahlungsdienstleistung Bbumfeld sap Ariba aktiv
Softwareentwicklung im Bankensektor;entwickeln groesster technologisch anspruchsvollst Omnikanalplattformen deutsch Bankingmarkt
Softwareentwicklung im Bankensektor;Design Entwicklung verschieden Softwareanwendung Bank Boersen Wertpapierhandelsumfeld
Softwareentwicklung im Bankensektor;Abteilung Entwicklung Kreditbasisfunktion ua verantwortlich fuer fachlich technisch Betreuung Weiterentwicklung Berechnungskomponent Fuer Aktivkont ueber gesamt Lebenszyklus Praesentation Ergebnis
Softwareentwicklung im Bankensektor;Banksoftwarediensleistunge Scand zielen massgeschneidert Anwendung bereitstellen bestehend verbessern
Softwareentwicklung im Bankensektor;Marktanteil Prozent messen Anzahl Bank Nummer Schweizer Bankensoftwarebranche groess Kantonalbanke akquirieren
Softwareentwicklung im Bankensektor;Cpu Softwarehouse Entwicklung Software Fuer Bank spezialisiert Konzern
Softwareentwicklung im Bankensektor;fertiggestellt Standardloesung finnova Banking Software ersetzen veraltet gesamtsystem gleichzeitig erfolgen Umbenennung finnova bankwar finnova
Softwareentwicklung im Bankensektor;Finanz Informatik bieten unterschiedlich itleistungen Entwicklung Produktion Bereitstellung bankingloesungen kernbanksyst Online Mobilebanking
Softwareentwicklung im Bankensektor;Finanz Informatik Zusammenschluss Sparkasse Informatik Finanzit entstanden Itdienstleister Sparkassenorganisation Deutschland
Softwareentwicklung im Bankensektor;flatexdegiro betreiben fuehrend schnell wachsend Onlinebrokerageplattform Europa
Softwareentwicklung im Bankensektor;Hypoport se eigenschreibweise Hypoport Hauptsitz Luebeck Muttergesellschaft Netzwerks Technologieunternehme Fuer Kredit immobilien Versicherungswirtschaft
Softwareentwicklung im Bankensektor;izb soft greifen neu Entwicklung Finanz itmarkt setzen itloesung Fuer Kunde
Softwareentwicklung im Bankensektor;izb soft unterstuetzen geschaeftsprozesse Sparkasse -- anfangen Anwendung Fuer medial Vertrieb Banksteuerung ueber Beratungssysteme Personal unterstuetzungs Kernbanksystem
Softwareentwicklung im Bankensektor;Marktloesung beinhalten Kernbanksystem indisch Oracletochter Iflex solutions Limited sap
Softwareentwicklung im Bankensektor;msg for banking Software Beratungsunternehme Geschaeftsfeld Bank Finanzdienstleistung Hauptsitz Frankfurt Main
Softwareentwicklung im Bankensektor;ppi unabhaengig Beratungs softwareunternehmen fuer finanzbranch zaehlt ueber Deutschland Arbeitgeber
Softwareentwicklung im Bankensektor;Sopra Financial technology decken relevant Bereich digital Bankgeschaeft Konzeption Softwareentwicklung ueber Bereitstellung Betrieb Service Support Fuer Online Banking apps vertriebsloesung Baufinanzierung selbstbedienungssysteme setzen bankfachlich technisch Anforderung effizient effektiv
Softwareentwicklung im Bankensektor;speziell Bank zugeschnitten Itloesung Leistung reichen Rechenzentrumsbetrieb ueber bankverfahren agree Appentwicklung
Softwareentwicklung im Bankensektor;Standardloesung finnova Banking Software fertigstellen Unternehmen Softwareapplikation fuer Finanzindustrie entwickeln
Softwareentwicklung im Bankensektor;Temeno group international taetig Schweizer Softwareunternehmen Bankensoftware spezialisieren
Softwareentwicklung im Bankensektor;Vorteil individuell Softwareentwicklung fuer Bank Lanars
Softwareentwicklung im Bankensektor;umfassen wesentlich Applikation Bereich Universal wholesal Retail privat Islamic Banking Bereich Microfinance Laender ueber Finanzinstitut Einsatz
Softwareentwicklung im Bankensektor;begleitest komplett softwarelifecycle Bankanwendung Verantwortest neu Weiterentwicklung Applikation Backend
Softwareentwicklung im Bankensektor;beraetst Kunde Bank Finanzdienstleister digital Transformation Weiterentwicklung Webanwendunge
Softwareentwicklung im Bankensektor;bringstn Erfahrung Bereich Webentwicklung Bank
Softwareentwicklung im Bankensektor;Entwicklung kundenspezifisch Software Koenne Bank sicherstellen System sicher effizient neu Stand
Softwareentwicklung im Bankensektor;softwareentwicklungsunternehm fuer Bank finden lohnen investieren schwierig unmoeglich
Softwareentwicklung im Bankensektor;Umstieg kernbanksyst Osplus
Softwareentwicklung im Bankensektor;Entwicklung Massgeschneidert Bankplattforme
Softwareentwicklung im Bankensektor;finnova eintragen finnova bankwar bankensoftwar spezialisiert Schweizer Unternehmen Sitz Lenzburg
Softwareentwicklung im Bankensektor;Fuer Ausbau digital Infrastruktur Onlineplattform Fuer Finanzdienstleister suchen sofort Festanstellung Java Entwickler Erfahrung Htmljavascript frontend Entwicklung idealerweise angular
Softwareentwicklung im Bankensektor;Fuer geschaeftsbereich aktiv firmenkund Bereich Entwicklung Kreditprozesse basisfunktion Abteilung Entwicklung Kreditbasisfunktion suchen naechstmoeglich Termin Fuer Standort Hannover Frankfurt Muenster Java Softwareentwickler Kreditumfeld Mwd Hannover Frankfurt Muenster Vollzeit
Softwareentwicklung im Bankensektor;fuer individualkund landesbank Versicherung deutsch Leasing skp stellen speziell abgestimmt Kreditloesung bereit
Softwareentwicklung im Bankensektor;fuer teams suchen Softwareentwicklerin Mwd Derdie bereit technisch Spezifika Themenfelde bedarfe Firmenkunde Bankensektor einlassen
Softwareentwicklung im Bankensektor;haeln Unternehmen groes Anteil Markt Schweiz Fuer banksoftware
Softwareentwicklung im Bankensektor;Kernaktivitaet liegen Entwicklung Vertrieb Softwarepaket Avaloq Banking suite derzeit Bank weltweit verwenden
Softwareentwicklung im Bankensektor;wissen Bedeutung persoenlich Finanzmanagement entwickeln Team System persoenlich Finanz verschieden Finanzanwendunge verwalten organisieren
Softwareentwicklung im Bankensektor;Bereich -- digital banking -- Epayment Digital learning Education entwickeln Crealogix internetbasiert Software
Softwareentwicklung im Bankensektor;kernbanksyst Agreealle ehemalig Gad eg angeschlossen Bank nutzen Gesamtbanksoftwareloesung Bank ehemalig Fiducia it angeschlossen Bank Loesung agree
Softwareentwicklung im Bankensektor;Konzerngesellschaft geschaeftsbereichedi Cpu Softwarehouse fungieren Holding Fuer tochtergesellschafn Software Fuer Bank entwickeln Dienstleistung Bankenumfeld erbringen
Softwareentwicklung im Bankensektor;Kunde Finanzit Sparkasse Landesbank anderer Gesellschaft Sparkassenfinanzgruppe Dwp Bank Geschaeftsgebiet
Softwareentwicklung im Bankensektor;Leitung softwareentwicklungsprojekten zb Kontext Digitalisierung Bankenprozesse zb vertriebskanael ua Online Banking Zahlungsverkehr bausparen Investment Wertpapiereberatung Trading Clearing Settlement Referenz Marktdatenmanagement Umsetzung regulatorisch Anforderung Kreditmanagement Marisk Basel iii Meldewesen kwg Optimierung geschaeftsprozesse Organisation Kunde bankenbereich betriebswirtschaftlich Aspekt
Softwareentwicklung im Bankensektor;ueber Mitarbeiter Standort digital Banking leistungsfaehig entwickeln smart Finanzservice
Softwareentwicklung im Bankensektor;Jahrzehnt Erfahrung Entwicklung Bank Finanzsoftware unterstuetzen Kunde Entwicklung Loesunge digital Transformation nutzen
Softwareentwicklung im Bankensektor;Mitte beginnen Unternehmen standardsoftwar fuer Bank entwickeln
Softwareentwicklung im Bankensektor;mobil App Uiux Fuer Onlinebanking
Softwareentwicklung im Bankensektor;Produkt Geschaeftsfeldermsg for Banking entwickeln Produkt Individualloesung Geschaeftsfeld Bank Finanzdienstleistung
Softwareentwicklung im Bankensektor;Sap bringen vorhanden Software Bereich Financial services sap for Banking erhaeln dafuer Anteil neu Firma
Softwareentwicklung im Bankensektor;Scand Bank Entwicklung Finanzsoftware unterstuetzen Kunde Erreichung finanziell Ziel
Softwareentwicklung im Bankensektor;Scand bieten vieler Loesunge prozess Erstellung Finanzbericht erleichtern
Softwareentwicklung im Bankensektor;Scand bieten vollstaendig Zyklus Entwicklung Software Fuer Bank einschliesslich Uiuxdesign Architekturplanung Bereitstellung test Wartung Support
Softwareentwicklung im Bankensektor;engagieren sap Finanzbereich Datawarehousing bieten Datenbankloesunge
Softwareentwicklung im Bankensektor;Anfang Erjahre Unternehmen Anbieter Fuer bankensoftwar finanzmathematisch seminaren Produktconsulting weiterentwickeln
Softwareentwicklung im Bankensektor;erstellen Nanosoft breit Palette Softwareloesung Fuer Bank Finanzdienstleister
Softwareentwicklung im Bankensektor;Experte objektorientiert Entwicklung sap kreditgeschaeft begleiten digital Wandel Hilfe agil Arbeitsweise
Softwareentwicklung im Bankensektor;L√∂sung verbinden Jahrzehntelange Knowhow Softwareentwicklung Banking modern Methode
Softwareentwicklung im Bankensektor;uebersetzen Methode Risikosteuerung anwendungsfreundlich Software Alltag Fuer ueber Bank Deutschland einfach Banksteuerung sicher
Softwareentwicklung im Bankensektor;Software fuer Bank individuell digital Loesung Bankgeschaeft
Softwareentwicklung im Bankensektor;Software Entwicklungsideen Fuer bankensektor
Softwareentwicklung im Bankensektor;Softwareentwickler backend Bankanwendung Java Mwd
Softwareentwicklung im Bankensektor;Softwareentwickler Bank Mwd
Softwareentwicklung im Bankensektor;Softwareentwickler Java ee finanzbranch
Softwareentwicklung im Bankensektor;Softwareentwickler Java Gesamtbanksteuerung Mwd
Softwareentwicklung im Bankensektor;Softwareentwickler Java Bankwesen Mwd
Softwareentwicklung im Bankensektor;Softwareentwickler Sap Abap oo Kreditumfeld mwd
Softwareentwicklung im Bankensektor;Softwareentwicklung Fuer Bankwesen
Softwareentwicklung im Bankensektor;Softwareentwicklung Fuer Zahlungsverkehr
Softwareentwicklung im Bankensektor;steigen Entwicklung Finanzprogramme Fuer Taschencomputer softwaregeschaeft Renditeprogramme programmierbaren taschenrechnern
Softwareentwicklung im Bankensektor;taetigkeitsschwerpunken Entwicklung Software Abwicklung saemtlich geschaeftsprozesse Unternehmen
Softwareentwicklung im Bankensektor;taetigkeitsschwerpunken Entwicklung Software Abwicklung saemtlich geschaeftsprozesse Unternehmen Buchfuehrung Controlling vertreiben einkauf Produktion Lagerhaltung Transport Personalwesen
Softwareentwicklung im Bankensektor;Itexpert stellen fachbereichen Kunde Partner innovativ verlaesslich Itinfrastruktur Anwendungsloesung bereit treiben Digitalisierung Automatisierung Bank voran
Softwareentwicklung im Bankensektor;vollstaendig Integration Onlinebankingsystemen
Softwareentwicklung im Bankensektor;Sciencesoft erstellt Software anwendung ermoeglicher Bank Finanzdienstleister
Softwareentwicklung im Bankensektor;Aracom konzipieren realisieren individualsoftwareloesungen Fuer Kunde stehen kompetent zuverlaessig softwareprojekten Seite
Softwareentwicklung im Bankensektor;bieten Entwicklung mobilebankinganwendung Internetbankingloesung digitalbankingdienstleistungen Geschaeftsprozessautomatisierung Migration Neuaufbau bestehend softwareloesung Integration extern Plattform Implementierung Payment Gatewaysystemen etc
Softwareentwicklung im Bankensektor;entwickeln mobil Zahlungsloesung detailliert Bericht ueber Unterstuetzung Multidevicekont erweitert Betrugsschutz reichen
Softwareentwicklung im Bankensektor;liefern kundenorientiert Loesunge Fuer Kunde Bereich Kryptowaehrung
Softwareentwicklung im Bankensektor;deutsch Firma Sitz Wolfsburg deutsch Bank Sparkasse Ausbau Softwareloesung Unterstuetzt
Softwareentwicklung im Bankensektor;Kunde msg for Banking zaehlen Sparkassenfinanzgruppe privat Geschaeftsbanke verbaend Rechenzentre Finanzabteilung Unternehmen
Softwareentwicklung im Bankensektor;Schwerpunkt zaehlt Entwicklung Support anwendungssoftwar Fuer Finanzdienstleister gesamt Bundesgebiet Oesterreich
Softwareentwicklung im Bankensektor;Geschaeftsbereich Produkt zaehlen Cpu bankensoftwar Gmbh Cpu bankensoftwar
Softwareentwicklung für Cloud-Lösungen;Cloudcomputingsparte Amazon web service wachstumsstaerkst ertragreichst Geschaeftsbereich Unternehmen
Softwareentwicklung für Cloud-Lösungen;Cloud Solution Architect
Softwareentwicklung für Cloud-Lösungen;Softwareentwicklerin Data Engineer verantworten Umsetzung skalierbaer data Analytics ai use cases Fertigungsumfeld basierend standardisiert Clouddatenplattform
Softwareentwicklung für Cloud-Lösungen;Schwarz Gruppe ebenfalls Handelskett Lidl Kaufland gehoeren moechten europaeisch Cloudmarkt nachhaltig mitgestalten
Softwareentwicklung für Cloud-Lösungen;agil Team entwickelen mittlerer Itprojekt Branchenloesung Basis Java
Softwareentwicklung für Cloud-Lösungen;devops Team stellen Betrieb Cloudanwendung ganzheitlich sicher
Softwareentwicklung für Cloud-Lösungen;Analyse Konzeptionierung Performant sicher Schnittstell fuer Anbindung Integration Assets Cloud Plattform
Softwareentwicklung für Cloud-Lösungen;Analyse aktuell eingesetzt Technologie Unternehmen herausstellen Verbesserungs Weiterentwicklungsmoeglichkeiten Fuer Bereich Cloud Technologien
Softwareentwicklung für Cloud-Lösungen;Analyse Konzeption Entwicklung betreiben skalierbar sicher Cloud Anwendungsarchitektur
Softwareentwicklung für Cloud-Lösungen;anderer Softwarehersteller Lage Software ueber Plattform saasdienst anbieten
Softwareentwicklung für Cloud-Lösungen;Arbeit verschieden Produkt heterogen Softwareumfeld Firmware sps Cloudanwendung mobil endgeraet reichen
Softwareentwicklung für Cloud-Lösungen;anderer Seite knuepfen Loesung Inmemorydatenbankplattform Sap Hana wodurch Unternehmen Cloud Datenbank Anwendungsservices mobil dienste zugreifen Koenn
Softwareentwicklung für Cloud-Lösungen;mehrere Dienstleistung integriert devopsdienste Unterstuetzt cloudanwendungen Erstelle auszufuehren bereitstellen verwalten
Softwareentwicklung für Cloud-Lösungen;Berufserfahrung mehrjaehrig Entwicklungserfahrung modern Programmiersprachenentwicklungsumgebung z b c java Nodejs gerne Erfahrung Cloudplattform bevorzugen aws
Softwareentwicklung für Cloud-Lösungen;Cloud Engineering Kenntnisse aws Infrastruktur incl kenntnisse Design Implementierung Cloud Infrastruktur
Softwareentwicklung für Cloud-Lösungen;create something New -- work for our cloud solution -- Bosch ebike systems -- analyse Design and implement Cloud backend services
Softwareentwicklung für Cloud-Lösungen;Cloud Mssql Engineer Mwd stackit genau
Softwareentwicklung für Cloud-Lösungen;daraufhin kuendigen Microsoft lokal dienstleistern sammenzuarbeiten gemeinsam dienste Cloud anbieten koennen
Softwareentwicklung für Cloud-Lösungen;Unternehmen bieten Kunde Stellflaech Rechenzentren Colocation direkt Anbindung Netzbetreiber anderer Unternehmen innerhalb Rechenzentrum sogenannter Interconnection
Softwareentwicklung für Cloud-Lösungen;Unternehmen vierzig Laender aktiv bieten Kunde Stellflaech Rechenzentren Colocation direkt Anbindung Netzbetreiber anderer Unternehmen innerhalb Rechenzentrum sogenannter Interconnection
Softwareentwicklung für Cloud-Lösungen;Unternehmen spezialisieren Entwicklung Vermarktung Computerhardware Software Fuer unternehmenskunden -- insbesondere Datenbanksystems oracle database
Softwareentwicklung für Cloud-Lösungen;vorgaengersystem Fuer Zweck online Service System Oss
Softwareentwicklung für Cloud-Lösungen;Kernaufgabe liegen Betreuung Team Bereich Konzeption Integration betreiben neu entwickelt Cloud basierter webanwendungen
Softwareentwicklung für Cloud-Lösungen;Deployment Betrieb Cloudloesung Simphera
Softwareentwicklung für Cloud-Lösungen;Zugriff Dropbox Browser Hilfe Anwendung App verschieden Betriebssystem moeglich
Softwareentwicklung für Cloud-Lösungen;Design Entwicklung neu Cloud Ready applikation Amazon aws
Softwareentwicklung für Cloud-Lösungen;develop and deploy New services for the adobe cloud Platform
Softwareentwicklung für Cloud-Lösungen;aktuell stattfindend grundlegend Modernisierung Software Weg Cloud ermoeglichen Einarbeitung intensiv einblicke Funktionsumfang Unterstuetzten fachprozesse bringen voran Fuehrender europaeisch Anbieter Finanz Vorsorgeloesung unterstuetzen Leidenschaft Mensch finanziell fuer sorgen -- Leben
Softwareentwicklung für Cloud-Lösungen;Entwicklerplattform basieren Technologie cloud Foundry laeufen Ibms Softlayercloudinfrastruktur
Softwareentwicklung für Cloud-Lösungen;arbeitestn Aufbau hochperformant Cloudplattform Basis Openstack Fokus Bereitstellung comput Ressource grafikart virtuell Maschine unterschiedlich Architektur
Softwareentwicklung für Cloud-Lösungen;arbeitest eng Integration Betriebssysteme cloudinfrastrukturen sicherstellen
Softwareentwicklung für Cloud-Lösungen;beruecksichtigst Itsicherheit Weiterentwicklung cloudloesungen Betrieb Kenntnisse ueber verbreiten Monitoringwerkzeuge suchen Cloud Solution Architect Wmd
Softwareentwicklung für Cloud-Lösungen;besitzen fundiert kenntnis Automatisierung Betriebssysteme vorzugsweise Cloudumfeld
Softwareentwicklung für Cloud-Lösungen;betreusen betreibst verschieden technisch System Bereitstellung Cloudumgebun
Softwareentwicklung für Cloud-Lösungen;betreusen betreibst verschieden technisch System Bereitstellung Cloudumgebung Betrieb Cloud
Softwareentwicklung für Cloud-Lösungen;zustaendig Fuer Umsetzung Management cloudbasiert Projekt eng
Softwareentwicklung für Cloud-Lösungen;bringstn Erfahrung Umgang modern Cloudtechnologi zb aws azure Konfiguration stabil netzwerken Proxy Https vpn etc
Softwareentwicklung für Cloud-Lösungen;bringstn Cloud voran Konzeption Umsetztung
Softwareentwicklung für Cloud-Lösungen;Designst Projektierst Loesung Kommunikation Cloud nativ Applikation ueber applicationmesh
Softwareentwicklung für Cloud-Lösungen;entwickelen gemeinsam Team Fuer jeweilig Loesung benoetigt Cloudinfrastruktur Verwendung infrastructure as Code Marke Rexroth entstehen innovativ Komponente Massgeschneidert Systemloesung Dienstleistung Fuer mobil anwendung Anlagenbau Engineering Fabrikautomation
Softwareentwicklung für Cloud-Lösungen;entwickelen Team neu Datenbankplattformumgebung Cloudplattform
Softwareentwicklung für Cloud-Lösungen;entwickelst skalierbar verfuegbar Performante Cloudumgebungen Basis Amazon web services aws
Softwareentwicklung für Cloud-Lösungen;entwickelen optimierst innovativ individualsoftwareloesungen Kundenanforderung Interdisziplinaer arbeitend Team Massgeschneidert Softwaretools Suit ideal Ansprechpartner Fuer prozess Software konsequent anwendersichen Zusammenarbeit entwickeln gelten Sinn verstehen Bahnhof
Softwareentwicklung für Cloud-Lösungen;entwickelen implementierst wartest Loesunge Basis sap commerce Cloud ehemals hybris Zusammenarbeit extern
Softwareentwicklung für Cloud-Lösungen;entwirfst setzen automatisiert Prozesse Bereitstellung Konfiguration Ueberwachung Linux Unixsystem Cloud
Softwareentwicklung für Cloud-Lösungen;gestaltestn Entwurf Umsetzung Weiterentwicklung hochverfuegbaren Cloud services
Softwareentwicklung für Cloud-Lösungen;Erfahrung Healthitprojekt Cloud Umgebung onpremise weissen erfolgreich vermeiden schief
Softwareentwicklung für Cloud-Lösungen;Interesse agil arbeiten Kontext cloudloesungen
Softwareentwicklung für Cloud-Lösungen;kenntnis Umfeld Publiccloudloesung bzw Thema fremd
Softwareentwicklung für Cloud-Lösungen;integrierst Loesunge Onpremise Clouds Caas Paas
Softwareentwicklung für Cloud-Lösungen;interessierst fuer Datenbanken cloudplattformen zb azure aws technisch organisatorisch Herausforderung Betrieb Softwaresystemen Cloud bringen
Softwareentwicklung für Cloud-Lösungen;berichtest cloud solutions and services leistesen wichtig Beitrag Fuer Kunde weltweit waehrend etabliert Unternehmen Faehigkeit weiterentwickeln könnsten
Softwareentwicklung für Cloud-Lösungen;langjaehrig Erfahrung Entwicklung Design Beratung Kunde hinsichtlich Loesungen Ecommerceumfeld Basis sap commerce Cloud hybris nachweisen
Softwareentwicklung für Cloud-Lösungen;plansen entwickelen azure cloudinfrastrukturen Applikationsarchitektur
Softwareentwicklung für Cloud-Lösungen;plansen Konzipierst implementierst innovativ Loesung umfeld Sap commerce Cloud Ziel geschaeftsprozesse customer experience Bereich marketing Sales optimieren
Softwareentwicklung für Cloud-Lösungen;stellen Erweiterung cloudbasiert Infrastruktur public Hybrid Cloud sicher
Softwareentwicklung für Cloud-Lösungen;Testest betreibst innovativ Anwendung Cloudumgebung kubernet
Softwareentwicklung für Cloud-Lösungen;Uebernimmst Beratung Cloud umsetzungsprojeken Enterprise cloud solution --
Softwareentwicklung für Cloud-Lösungen;tief praktisch Erfahrung Implementierung use cases Microsoft Azure Synapse Analytics Datenintegration etl etc Power bi Cloud Anwendung anderer services zb machine learning
Softwareentwicklung für Cloud-Lösungen;unterstuetzen Optimierung Cloud Datawarehouse hinsichtlich Performance Skalierbarkeit
Softwareentwicklung für Cloud-Lösungen;unterstuetzen Aufbau hochperformant Cloudplattform
Softwareentwicklung für Cloud-Lösungen;unterstuetzen Aufbau Datenbankservice Cloudplattform
Softwareentwicklung für Cloud-Lösungen;Verantwortest Cloudarchitektur Integration stimmsen Stakeholder
Softwareentwicklung für Cloud-Lösungen;Ziel Umgebung schaffen mobil Cloudanwendung schnell Baustein zusammensetzen codeschnipseln individualisier automatisiert testen Knopfdruck installieren Cloud betreiben lassen
Softwareentwicklung für Cloud-Lösungen;entwerfen pflegen Erarbeitung eventbasiert Pipelines Onpremise Welt public Cloud verbinden
