Sonstiges;zusaetzlich simple Workflow Service sws Simple Email Service ses simple queue Service sqs Simple Notification Service sns dienste Fuer Entwickler bereitstellen
Sonstiges;zuverlaessig kompetent unterstuetzen Inbetriebnahme Wartung entwickelt System
Sonstiges;fuehrend Anbieter technisch anspruchsvoll Produkt Loesunge Dichtungstechnik fuer zahlreich Industriebranch engagiert fachlich kompetent bieten weltweit Kundenstamm innovativ Loesungen Fuer zukunftsweisend Anwendung
Sonstiges;bieten Datenbankloesungen maxdb sap ase sap iq Sap Hana
Sonstiges;Unternehmen attraktiv Sitz Grossraum minden erreichbar Niedersachsen ostwestfalen abwechslungsreich Aufgabenfeld anspruchsvoll Position verantwortlich fuer Umsetzung innovativ Konzept begleiten gestalten prozeß Konzept ueber Industrialisierung Serienreife
Sonstiges;Erfahrung Solution Provider Fuer digital Patientenversorgung Arbeit agil international Scrumteam modern cool
Sonstiges;Mitarbeiter Forschung Softwareentwicklung
Sonstiges;erwirtschaften Umsatz ueber Million Usdollar
Sonstiges;agil Entwicklung abwechslungsreich innovativ softwareprojekten Fuer Branchenfuehrer
Sonstiges;agil Softwareentwicklung z b Kanban Scrum
Sonstiges;aktiv zielstrebig Entwicklung Mitarbeiter
Sonstiges;agil coach praegst Mindset Teamsprojekt Kundenaccounts hsen servant Leader Vorweg Fuehrst Team ruhig Hand Reife
Sonstiges;Centwickler Fuer Software gom Volum Inspect pro entwickelen algorithm Funktion Workflow fuer Ctdatenanalyse
Sonstiges;entwickeln betreuen wiederverwendbar Softwaremodule vieler verschieden Produkt
Sonstiges;arbeiten Loesunge setzen Idee neu Technologie
Sonstiges;global innovationsfuehrer fuer Maschine Produktionsloesung Brillenglas Feinoptikindustrie bieten erstklassig Technologie massgeschneidert Dienstleistung
Sonstiges;Kompetenzcenter Payment Sparkassenfinanzgruppe entwickeln vermarkten federfuehrend ganzheitlich zielgruppenspezifisch omnikanalfaehig paymentloesungen Fuer privat Firmenkunde Sparkasse sowohl fuer pos fuer e Mcommerce
Sonstiges;Mitglied genossenschaftlich Finanzgruppe mitarbeitend Partner Volksbanke Raiffeisenbank
Sonstiges;Projekt programmmanag verantworten Leitung Realisierung komplex interdisziplinaeren Grossprojekt
Sonstiges;Softwareentwickler Automatisierungstechnik realisieren Anlagensoftwar 
Sonstiges;softwareentwickl Messystem verantwortlich Fuer Betrieb laufend Pflege kontinuierlich Weiterentwicklung Shopflooritsystem
Sonstiges;Softwareentwickler schwerpunkt Testkonzept Automatisierung Wmdiv zustaendig fuer Ableitung Definition Massnahme Verbesserung softwarequalitaet Testaktivitaet
Sonstiges;Softwareentwickler fuer Konzeption Entwicklung Realisierung Seriensoftware verantwortlich
Sonstiges;Standardloesung Business Bydesign Masse sap erp modifizierbar
Sonstiges;Amazon bieten Elastic Beanstalk Paas Fuer Java python Docker Plattform
Sonstiges;Analyse Konzeption Programmierung Softwareprodukt sap Anwendungsentwicklung objektorientiert Hochsprach C Java c
Sonstiges;Anforderungsmanagement Rahmen App Cloudentwicklung dh erarbeiten user Stories Erstelle Dokumentation Azure devops
Sonstiges;Ansprechpartner Fuer Kunde Bereich kundenanforderung
Sonstiges;arbeiten gerne it Beratung modern Arbeitgeber flexibl Struktur persoenlich Entwicklungsmoeglichkeit individuell Weiterbildungsprogramm
Sonstiges;Aufnahme Definition Analyse Softwareanforderung
Sonstiges;August geben Microsoft Microsoftcloud Deutschland Fuer Neukunde Verfuegung stehen neu dienste bereitstellen
Sonstiges;ehemals eigenstaendig Rechenzentre Sparkassenorganisation entstehen Reihe Fusion zusammenschluessen Finanz Informatik
Sonstiges;Ausbau Betreuung pflegen neu bestehend partnerschaftlich Kundenbeziehung Ziel Kundenzufriedenheit langfristig Kundenbindung
Sonstiges;arbeitestn agil Entwicklungsteam intern extern entwicklern Produktmanager Anwender funktional Beduerfnis komplex technisch loesungsraeume ueberfuehren
Sonstiges;automatisiert Bereitstellung stetig Optimierung Infrastruktur
Sonstiges;Begleitung Entwicklung Produkt Konzeption ueber Umsetzung Qualitaetspruefung Bereitstellung
Sonstiges;Konzeption kreativ Problemloesung hsen analytisch ausdauernd qualifikationen
Sonstiges;einzigartig Chance Leidenschaft Fuer Softwareentwicklung modern Technologie verbinden dynamisch Umfeld kontinuierlich wachsen
Sonstiges;Moeglichkeit innovativ gleichzeitig erfolgreich erpsoftwar Zusatzmodule Expertise optimieren
Sonstiges;Beobachtung Markt Wettbewerb Erkennung Trend Ecommerce 
Sonstiges;Beratung Fuer optimal Einsatz System Kundensupport Ndlev
Sonstiges;Betreuung Ansprechpartner praktisch Umsetzung Feld
Sonstiges;Business Bydesign Ondemandunternehmenssoftware Echtzeit abfragen Reports generieren
Sonstiges;dafuer digitalisieren unternehmensprozessen Begleiter Sache Innovation
Sonstiges;darueber hinaus uebernehmen Verantwortung innerhalb expandierend Unternehmensgruppe beteiligen intern itprojekten
Sonstiges;Projekteinsatz erfolgen namhaft Unternehmen Itbranche dynamisch Team erwarten spannend Aufgabe freundlich Arbeitsatmosphaer
Sonstiges;Entwicklung bestehend neu Itfachverfahr softwareloesung Datenbank zustaendig
Sonstiges;detailliert Monitoring zielgerichtet Test Fuer gluecklich Kunde
Softwareentwicklung im Bankensektor;Avaloq Group Sitz Freienbach Software Finanzdienstleistungsunternehm
Softwareentwicklung im Bankensektor;Fakt Parclt fuehrend Anbieter Software Methodikdienstleistung Fuer banksteuerung Risikomanagement Ratingverfahr Deutschland
Softwareentwicklung für Cloud-Lösungen;Cloudsysteme Fuer datensensitiv Unternehmen spezialisieren 
Sonstiges;erfolgreich Partner Softwareentwicklung verschieden Branche
Sonstiges;arbeitestn Entwicklerteam Produkt Forschungsbezogen idmprojekt
Softwareentwicklung im E-Commerce;Digital nativ bzw onlineaffinitaet idealerweise Ecommerceerfahrung dc Onlineshops
Sonstiges;entwickelstn Anwendung dynamisch Umfeld
Sonstiges;entwickelen international Team Applikationssoftware Ansteuerung industriell xraysystemen Generierung volumendaten
Sonstiges;entwickelst Software fuer Embedded Sensor Systems 
Sonstiges;erstellen anforderungsanalysen stimmsen technisch fachlich Anforderung stetig Kunde kundinnen
Sonstiges;erstellen Testspezifikation verantwortlich Fuer Fehleranalyse Erstellung testberichten
Sonstiges;erweiterstn Software neu Versicherungsprodukt implementierst Loesungen Fuer fachanforderunge
Sonstiges;findest Software Engineering spannend moechtest faszinierend Branche eintauchen kennen bestens Fuer neu Digitalstrategie setzen individuell hochwertig softwareloesung entwickeln vieler Anwendung 
Sonstiges;fuehrst funktional strukturell Test Fahrzeugfunktion Testwerkzeug Embedded Plattform
Sonstiges;eigenverantwortlich teamorientieren Arbeitsweise
Sonstiges;Erfahrung Softwareentwicklung 
Sonstiges;integriersen Softwarekomponent Gesamtsoftware 
Sonstiges;integriersen neu Strategie Arbeitest uebergreifend Projekt
Sonstiges;bieten Einstiegsposition Fuer Mensch Spass Cloudtechnologien hantieren Automatisierung voranzutreiben
Sonstiges;konntest Projekt Tools visualstudio Git Jira umsetzen
Sonstiges;Konzipierst Realisierst Projekt Rollout
Sonstiges;Kuemmerst Konzept Umsetzung neu Anforderung
Softwareentwicklung im E-Commerce;Experte Ecommerce entwickeln Bbonlineshops 
Sonstiges;moechtest Marke Ecommerce digital Geschaeftsmodell Fuer endverbrauch aktiv mitgestalten
Sonstiges;moechtest gesamt Softwareentwicklungsprozess verstehen geschaeftskritisch Individualsoftware hoechst Niveau gestalten
Sonstiges;moechtest gesamt Softwareentwicklungsprozess verstehen geschaeftskritisch Individualsoftware hoechst Niveau gestalten suchen Zukunft Software Engineering global agierend Unternehmen
Softwareentwicklung für Cloud-Lösungen;Cloud Network Engineer Mwd stackit genau jung Corporate startup Fuer digital Service Colocation Cloud
Sonstiges;moechtest Ausbildung moeglich Ecommerce Schritt Berufsleben starten
Sonstiges;setzen gerne Kundenwuensch bereit neu Technologien vertiefen
Sonstiges;suchen neu beruflich Herausforderung innovativ Unternehmensgruppe
Sonstiges;sowohl Moeglichkeit breit wissen vieler verschieden Bereich aneignen spezialisieren Experte Gebiet
Sonstiges;Crossfunktionalen Produktentwicklung Mechanik Elektronik firmware anwendersoftwar clouddien
Sonstiges;zeichnest analytisch Vorgehensweise Freude Ausdauer Konzeption kreativ Problemloesung
Sonstiges;langjaehrig Erfahrung umfassend Knowhow Entwicklungsteam sorgen fuer erfolgreich passend Loesung
Sonstiges;Praktika oae Erfahrung Bereich Marketing speziell Bereich Business Development Ecommerce sammeln
Sonstiges;egelmaessig Berichterstattung Projektfortschritt vorgesetzt
Sonstiges;eigenverantwortlich betreuen Phase innerhalb Spssoftwareentwicklung
Sonstiges;eigenverantwortlich Uebernimmst Projektkoordination
Sonstiges;eigenverantwortlich Handlungsbereich selbststaendig Arbeitsplanung
Sonstiges;Kern dafuer benoetig Simulation bilden Erzeugung virtuell steuergeraet Vecus Produktive Seriencode fuer Ausfuehrung Softwareintheloopumgebung integrieren
Sonstiges;einblicke Bereich Ecommerce Onlinemarketing Customer success Vertrieb Finance helfen verstehen professionell Onlinevertriebsplattform ausmachen prozeß Onlinevertrieb verbergen
Sonstiges;Einfuehrung Erweiterung Ecommercereporting
Sonstiges;Einsatz verschieden frameworks Technologie Entwicklung Integration notwendig Softwarekomponent u Typescriptjavascript spring Boot Rest open api
Sonstiges;engineering People Vision Mensch Idee Technik zusammenkommen
Sonstiges;entdecken Facette Software Engineering Planung Betrieb Konzept Implementierung testen Kundenkontakt
Sonstiges;entwickeln pflegen etabliert Software Anwendung Maschinensteuerung Windows betriebssystemen
Sonstiges;Entwicklung echtzeitfaehig Softwareloesung Twincat
Sonstiges;Zug entwickelen Desktop webapplikationer Softwarearchitektur
Sonstiges;Entwicklung hardwarenah Software Fuer Aurix Plattform
Sonstiges;Entwicklung Massgeschneidert Softwareloesung
Sonstiges;Entwicklung Steuerungsloesung Bereich Bewegungssteuerung Bahnplanung verteilt System
Sonstiges;Erarbeitung Projektplaen Verantwortung Fuer Aufwandskalkulation Einhaltung budgetplaenen
Softwareentwicklung im E-Commerce;erfahren Softwareentwickler Programmierer Fuer Ecommerce Loesungen
Softwareentwicklung im E-Commerce;Erfahrung Onlineshop Entwicklung Bzw Bereich Ecommerce idealerweise Bbumfeld Praxis Projektmanagement 
Sonstiges;Erfahrung agil Softwareentwicklung einschlaegig Berufserfahrung idealerweise Erfahrung Betrieb komplex 
Sonstiges;Erfahrung knowhow besitzen Expertise Softwareentwicklung 
Sonstiges;Erstellung zugehoerig Dokumentation arbeitsanweisungen 
Sonstiges;Erstellung Dokumentation Fuer Knowhowtransfer Support Endanwendern
Sonstiges;schnell wachsend Technologiedienstleistungsunternehmen Loesunge Bereich Software Embedded engineering technisch Kommunikation spezialisieren
Sonstiges;flach Hierarchie schnell Entscheidungswege Gestaltungsraum
Sonstiges;fokussieren versicherungsbereich bieten itloesung Beratungsleistung Digitalisierung Versicherungsbranche fuehrend Anbieter Fuer itloesungen Consulting versicherungsbranch
Softwareentwicklung für Cloud-Lösungen;Fuer Verstaerkung Team suchen fuer Hauptsitz Freiburg Cloud Entwickler dwm geben spammern Chance Softwareloesung Unternehmen Moeglichkeit professionell Emailmarketing betreiben
Sonstiges;Fuer Zufriedenheit Kunde liefern digital vernetzt Loesunge Hoechster qualitaet vereinbart Zeitpunkt
Sonstiges;Schwerpunkt Softwareentwicklungsprojekt Bereich Homologation Datenmanagement
Sonstiges;Fuer Projekt foerdergeldern Landesregierung Rahmen Forschungsprojekt unterstuetzen
Sonstiges;Fuer attraktiv wachsend Itdienstleistungsunternehm suchen Fuehrungsaufgabe Grossprojektleiter programmmanag
Sonstiges;Fuer Kunde dynamisch international einzelhandelsunternehm weltweit ueber Mitarbeiter Laender beschaeftigen
Sonstiges;fuer Abteilung Marketing enior Product Owner 
Sonstiges;suchen naechstmoeglich Zeitpunkt Softwareentwickler Schwerpunkt Softwaretest
Sonstiges;suchen fuer Bereich Entwicklung Softwareentwickler Schwerpunkt Softwaretest 
Sonstiges;gemeinsam fuer digitalisiert zukunftsfaehig lebenswert Welt
Sonstiges;gemeinsam Team entwickelen Konzept setzen neu Anforderung Anforderung
Sonstiges;gemeinsam Team zentral entwicklerteams extern Software dienstleistern erarbeiten itloesungen entwickeln Fuer produktiv Einsatz international Fertigung
Sonstiges;Aufgabe Team Cloudstrategie Daimler Trucks and busses Form weiterentwickeln Kunde zukunftsfaehig Cloudplattform 
Sonstiges;gestalen Zukunft Ehealth Softwareentwickler Webapp Mwd Fuer naechster Stufe Ehealth Evolution suchen kreativ Koepfe Spass Arbeit vielfaeltig Technologie Gestaltungsspielraeume beruflich Weiterentwicklung
Sonstiges;gestalten Softwareengineering prozesses insbesondere Einsatz modern frameworks Technologie gehoert Aufgabe
Sonstiges;gestalten clever innovativ Loesunge agil Team
Sonstiges;Gewaehrleistung Uebersichtlichkeit Usability Anwendung
Sonstiges;ggf Interesse Rolle Scrum Master
Sonstiges;hierbei analysieren Anforderung entwickeln verbessern Software Schnittstell erstellen testplaen Dokumentation extrahieren transformieren datenstrukturen
Sonstiges;hierbei stehen Entwicklung Anwendungssystem Anpassung Einbindung verschiedenst Standardsoftwareprodukt Fokus
Sonstiges;hierzu Konzipierst implementierst Softwareloesung Testinfrastruktur sorgstn Fuer Betrieb
Sonstiges;obliegen loesungsorientiert Erstellung neu use Cases Fuer Testumgebung
Sonstiges;tragen ganzheitlich Verantwortung Fuer Itloesung vw Konzern gestalten kontinuierlich Erneuerung Unternehmensit entlang gesamt digital Wertschoepfungskette aktiv
Sonstiges;Hilfestellung Fuer Kunde Rahmen Refinementworkshops Definition Anforderung
Sonstiges;Home Office Moeglichteilzeitvollzeit
Sonstiges;Home Office Moeglichvollzeit beschaeftigen europaeisch Laender arbeiten Begeisterung Engagement Fuer Marke Bofrost
Softwareentwicklung für Cloud-Lösungen;IBM Bluemix Ibm entwickelt Cloudplattform Service Paas
Sonstiges;IBM weltweit fuehrend Unternehmen insbesondere fuer branchenspezifisch Produkt Dienstleistung itbereich Software Hardware
Sonstiges;ideal Weise verfuegen ueber mindestens Berufserfahrung Softwareentwicklung insbesondere Programmierung Microcontrollern berufseinsteigern geben gerne Moeglichkeit Einstieg spannend Thema
Sonstiges;idealerweise Berufserfahrung Bereich Email Marketing online Marketing Ecommerce
Sonstiges;idealerweise konntest Berufserfahrung Entwickler Mwd Devops Team Schwerpunkt Betrieb technisch Betreuung softwareanwendung Application Manager Mwd sammeln Erfahrung Cicd automatisiert Deployment pipelin Testing entsprechend frameworks
Sonstiges;identifizieren Automatisierungspotential it bzw Softwaregestuetzt prozeß
Sonstiges;Bereich Ecommerce gehoeren sowohl monatlich Ecommerce Tracking Optimierung Pflege Produktpraesenz Rdparty Partner klassisch Aufgabe
Sonstiges;Rahmen Ausbildung Zurm Kauffrau Kaufmann Ecommerce erwarten
Sonstiges;Rahmen Digitalisierungsoffensive besitzen Rahmen Architektur Aufgabe vorgehensweise prozeß Technologie Kontext
Sonstiges;Rahmen Taetigkeit Itapplikationsspezialist mwd Fuer kundenprojekte stellen Implementierung Durchgaengiger itloesungen
Sonstiges;Rahmen Praktikum Onlinemarketing erhalten umfassend kenntnis Bereich Ecommerce digital Transformation international taetig Premiummark
Sonstiges;Team weiterentwickeln setzen Staerk Teamarbeit profitieren intern Communitys
Sonstiges;Team Steuerungstechnik staerken Exenti Standort Fuer Plattform System Malterdinge Entwicklung Implementierung industriell Bildverarbeitung steuerungsnah Software Fuer Kunde Technologieprojekt
Sonstiges;Team ueberpruefen vorgehensweisen gestalten Prozesslandschaft staendig neu
Sonstiges;Implementierung Ergaenzung Schnittstell anderer System z b uebergeordnet sps extern Sensorvisionsystem softwareprodukten Unternehmensgruppe
Sonstiges;Betrachtest Loesungsraum ganzheitlich verschieden Perspektive -- funktional Ebene Schnittstelle Richtung Business ueber nichtfunktionaler Anforderung Betriebsfaehigkeit
Sonstiges;letzter Amazon zahlreich Webservices entwickeln Verwaltung Kernangebot dienen
Sonstiges;Administration Cloudsystemen
Sonstiges;agil Entwicklungsteam fuer Webentwicklung Software Fuer industriell Automation verantwortlich
Sonstiges;Fuer Ressourcenmanagement verantwortlich Fuer Gestaltung Implementierung Optimierung automatisierungsloesungen Verwendung Kapazitaetsmanagementtool 
Sonstiges;neu Job Softwareentwickler stellen Implementierung Weiterentwicklung softwareprojekten 
Sonstiges;Ecommerceteam setzen Zusammenarbeit Lust gemeinsam weiterzukommen
Sonstiges;international Team betreuen Software Bestandskunden helfen Fuer aktuell Marktanforderunge wappnen
Sonstiges;verantwortlich Fuer Entwicklung Nutzung Rest apis fuer frontend Backendentwicklung Bezug Kapazitaetsmanagementtool
Sonstiges;praktisch kenntnis Performance marketing Vorteil
Sonstiges;individuell abgestimmt Foerderungsmassnahm staendig Weiterentwicklung
Sonstiges;innovativ Entwicklungsdienstleistungen kreativ Produktdesign modern Softwarekonzept ergaenzen Produktportfolio
Sonstiges;interessant Projekt ueberwiegend Automotive Bereich
Sonstiges;Aufgabenfeld Onlinehandel einhergehend vertriebsorientiert Funktion Unternehmen fokussieren
Sonstiges;kaufmaennisch Ausbildung Schwerpunkt Ecommerce Marketing relevant Berufserfahrung
Sonstiges;kenntnisse ueber Messung Energieverbrauch pro prozess Softwareanwendung Cloud tief Verstaendnis Faktor Messunge beeinflussen
Sonstiges;Kerngeschaeft Einzelhandel
Sonstiges;Kollege qualitaetsanspruch digital Loesunge
Sonstiges;Konzeption agil Entwicklung Softwaresystemen web Iotumfeld
Sonstiges;Konzipierung Modellierung konzernweit Integration Loesungsarchitektur Beruecksichtigung Migrationsszenarien
Sonstiges;Leidenschaft Fuer technologisch Fortschritt ausleben
Sonstiges;Leitung Steuerung interdisziplinaeren Projektteam Beruecksichtigung klassisch agil hybrid Wert Methode
Sonstiges;entscheidend Schritt Karriere bewerben Cloud Software Architect
Sonstiges;Management Ecommercevertriebspartner direkt Distribution Steigerung umsatz Rentabilitaet Fuer stark Markenpraesenz
Sonstiges;mitarbeitend geben Digitalisierung geschaeftsprozesse ueber kundinnen vorantreiben
Sonstiges;Microsoft Azure azure Cloudcomputingplattform Microsoft Dienst sql azure Appfabric Linie Softwareentwickler richten
Sonstiges;Knowhow Leidenschaft entwickeln mitarbeitend weltweit innovativ Loesunge Dienstleistung
Sonstiges;modern technologisch System intelligent Loesunge 
Sonstiges;modern wissensbasiert Team technologiepartn Namhafter Unternehmen 
Sonstiges;Softwareprodukt Projekt Portfoliomanagement Ressourcenplanung Systemintegration 
Sonstiges;Spass abwechslungsreich Taetigkeit bringstn Leidenschaft Fuer Bereich Softwareentwicklung
Sonstiges;ntt Data gehoert weltweit fuehrend dienstleistern fuer business Itloesung
Sonstiges;online marketing Manager Kaufmann Ecommerce 
Sonstiges;Programmierung Software datenaustausch anderer System 
Sonstiges;Realisierung Industrie iotloesungen Logistikumfeld Datenbankdesign gui Design Applikationserstellung etc
Softwareentwicklung für Cloud-Lösungen;rollen suchen software developer Software Entwickler backend Developer backend Entwickler bieten branchenuebergreifend Beratungsdienstleistung Entwicklung Loesunge Fuer Backends Devops Cloud Umfeld
Sonstiges;sap Customer Checkoutsap Customer Checkout point of sales Solution Fuer Bereich Einzelhandel 
Sonstiges;sap Labssap Lab forschungs entwicklungseinrichtungen Kernprodukt sap entwickeln verbessern
Sonstiges;sap Business Bydesign weiterentwickeln zwingend Anpassung gesetzlich Aenderung vornehmen
Sonstiges;Scrum master Cloud loesungen Big Data  suchen
Sonstiges;selbststaendig erarbeiten neu Loesungsansaetze
Sonstiges;realisieren spannend Projekt Fuer namhaft Anbieter Entwickler Itloesung entwickeln hardwarenah softwareloesung Embedded Systems Steuerung mechanisch Komponent
Sonstiges;Sicherheit Umgang Gespraechspartner entscheidereben Erfahrung Bereich Presalesaktivitaet
Sonstiges;arbeiten engagiert Entwicklungsteam Swentwickler Applikationsspezialist
Sonstiges;arbeiten eigenverantwortlich wechselnd Aufgabe digital Transformation Branche
Sonstiges;arbeiten interdisziplinaeren Projektteam
Sonstiges;arbeiten Eigenverantwortung Selbstorganisation agil Team
Sonstiges;besitzen abgeschlossen Studium wirtschafts Informatik abgeschlossen Ausbildung Fachinformatiker
Sonstiges;betreuen pflegen entstehend Individualsoftware ueber gesamt Lebenszyklus 
Sonstiges;entwickeln international Team Applikationssoftware
Sonstiges;entwickeln Programm Lohnabrechnung Buchhaltung per Grossrechner ermoeglichn
Sonstiges;erstellen Programm Integration Webloesung
Sonstiges;geniessen flach Hierarchie koennen Idee einbringen Zukunft Kernbankensystem aktiv mitgestalten
Sonstiges;gestalten massgeblich Softwareentwicklung Fuer Themenfeld product security
Sonstiges;Bereich Softwaretests durchgefuehrt
Sonstiges;Freude anspruchsvoll Softwareentwicklung Fuer komplex System Hochtechnologiebereich voranbringen
Sonstiges;konzipieren entwickeln dokumentieren implementieren klein Team unternehmensintern Software beispielsweise Datenerfassung Auswertung Prozessdigitalisierung Automatisierung agil Methode
Sonstiges;Suche wertvoll Praxiserfahrung Bereich Ecommerce digital Marketing
Sonstiges;zustaendig Fuer Pflege Weiterentwicklung Edgesystem aktuell Basis Edgexframework wobei umgebung Siemen Secomea as softwar
Sonstiges;tragen stetig Optimierung Entwicklungsprozesse
Sonstiges;Software Entwickler Erfahrung Unternehmensberatung Softwareimplementierung reichen zurueck
Sonstiges;Softwaredesign Implementierung Anteilig entwicklertests troubleshooting
Sonstiges;Speicherung Verwaltung Pruefdat Datenbank
Sonstiges;Systemanforderung Kunde systematisch analysieren Geprueft umsetzen
Sonstiges;Teamfaehigkeit Kommunikationsfaehigkeit
Sonstiges;Teamwork stehen uebergreifend dynamisch Team ecommerce services weiterentwickeln
Sonstiges;technisch Begleitung Vertriebsaktivitaet Presalesaktivitaet
Sonstiges;Beratungsgespraech erarbeiten gemeinsam professionell leistungsfaehig Itloesung
Sonstiges;Fachbereiche Itloesung optimal Geschaeftsprozesse unterstuetzen 
Sonstiges;Umsetzung neu Anforderung
Sonstiges;Umsetzung fachlich Anforderung technisch Spezifikation
Sonstiges;fuenfkoepfig Programmiererteam freuen
Sonstiges;suchen Einkaeufer Ecommerce  Direktvermittlung
Sonstiges;Mindset tuer flach Hierarchie Duzkultur Idee willkommen
Sonstiges;Werkstudent beobachteen neu Trend Entwicklung Bereich Ecommerce
Sonstiges;teiln Begeisterung Fuer professionell Softwareentwicklung
Sonstiges;Zusammenarbeitsmodell zeichnen agil Crossfunktionale Arbeitsweise Unternehmensbereich
Sonstiges;Aufgabe Ecom unit Thema Ecommerce Retail Media voranbringen international top Kunde ganzheitlich unterstuetzen beraten
Sonstiges;Erfolgsfaktor teamgeisen Weiterbildung
Sonstiges;Kunde Financial services Umfeld aktiv setzen fokussieren Projekt prozess Fachberatung dynamisch Bankenumfeld
Sonstiges;Marke Rexroth entstehen innovativ Komponente Massgeschneidert Systemloesung Dienstleistung Fuer mobil anwendung 
Sonstiges;Data Engineer Architect Azure Cloud staltesen Aufbau neu Datenplattform traegst massgeblich Umsetzung Datenstrategie
Sonstiges;Unterstuetzung Betreiber Rahmen Problem Management Analyse Bewertung Problemsituation Fehler
Sonstiges;Verantwortung Umsetzung neu Digitalstrategie Kunde
Sonstiges;Verhandlung Planung Umsetzung Leitung Programm
Sonstiges;verstaerke Werkstudent Mwd Bereich Ecommerce key Account Management
Sonstiges;Verwaltung zentral Governancerepositori Steuerung Ueberwachung Cloud
Sonstiges;vieler supportprozesse insbesondere upgrade Transportmanagement ueber Solution Manager abbilden
Sonstiges;innovativ Itloesung unterstuetzen digital Transformation Kunde weltweit unterschiedlich Branche
Sonstiges;beherrschen komplett Itklaviatur Support Softwarearchitektur Digitalisierung umfangreich Portfolio fuer
Sonstiges;bieten Moeglichkeit mobil arbeiten Arbeit flexibel innerhalb Deutschland ortsunabhaengig Remote erledigen
Sonstiges;bieten softwareloesung Service Beratung Fuer Kunde unterstuetzen verwaltungen serviceorientiert buergernah
Sonstiges;entwickeln innovativ vernetzt Geraete komplex Software Sensorik Hardware
Sonstiges;realisieren spannend Projekt Fuer namhaft Anbieter Entwickler Itloesung uebernehmen Verantwortung Fuer komplex entwicklungsprojekte
Sonstiges;realisieren spannend Projekt fuer namhaft Kunde Technologie fuer Branche fuer smart Integration Ittrends etabliert Loesunge
Sonstiges;Einfuehrung regelbetrieb Loesungen verschieden Team aktiv begleiten
Sonstiges;Team agil Methode modern Softwareentwicklungswerkzeuge Funktion fuer namhaft Automobilhersteller entwickeln Serie bringen
Sonstiges;Leidenschaft Innovationsgeist entwickeln Produkt komplex Spezialloesung hochdynamisch Umfeld
Sonstiges;suchen naechstmoeglich Termin Verstaerkung Team Praktikant mwd international Brandmanagement Ecommerce
Sonstiges;suchen fuer Abteilung Personalit Mitarbeiter
Sonstiges;vereinen hoechste qualitaet Innovationskraft positiv Energie Zusammenarbeit augenhoehe
Sonstiges;Zielsetzung Optimierung Kerngeschaeftsprozesse Itserviceprozessen Kunde Beratung Einsatz Individualsoftware
Sonstiges;Aufgabe gehoeren Analyse Konzeption Umsetzung Dokumentation Softwareloesung innovativ Umfeld
Sonstiges;fuer Erstellung Projekt Produktsoftwar zustaendig
Sonstiges;naechstmoeglich Zeitpunkt suchen Softwareentwicklerin Java 
Sonstiges;naechstmoeglich Zeitpunkt suchen unbefristen Mitarbeiter Mwd Bereich Ecommerce Onlineshop Onlinemarketing
Sonstiges;Verstaerkung Team suchen sofort software Entwickler Wmd voll Teilzeit Neuss ueber wissen Erfahrung fliessen innovativ Softwareloesung
